title,ingredient_list
New American Waldorf Salad,apples, arugula, yogurt, mayonnaise, Dijon mustard, celery, walnuts
Country Biscuits With a Twang,all - purpose flour, baking powder, ranch salad dressing, buttermilk
Scones,flour, sugar, salt, margarine, baking powder, instant Tang orange drink
Grandmas Beef Barbeque,vinegar, water, sugar, mustard, pepper, lemon juice, onions, ketchup, pork
Deep Dish Pizza,ground beef, canned tomato sauce, frozen pizza dough, part - skim mozzarella cheese
Chocolate Chip Date Picnic Cake Recipe,dates, water
Barbeque Pulled Pork,ketchup, brown sugar, vinegar, Worcestershire sauce, spicy brown mustard, black pepper, pork tenderloin
Neely's Barbecue Seasoning,paprika, sugar, onion powder
Rick's Steak Seasoning II,cayenne pepper, black pepper, chili powder, paprika, sugar, cumin, garlic powder, onion powder, salt
Magic Ginger Cake,self raising flour, butter, sugar, bicarbonate of soda, baking powder, golden syrup, ginger, milk
Toni's Pizza Dough,flour, dried yeast, salt, water, honey, olive oil, fresh ground pepper
Orange Flamingo,orange soda, whipped cream, grenadine
Salmon with Vegetables,salmon, edamame, carrots, salt, pepper, olive oil, butter
Sugared Bacon Appetizers,bacon, brown sugar, cinnamon
Roasted Brussels Sprouts With Pine Nuts,Brussels sprouts, dried thyme, dried oregano, pine nuts, kosher salt, black pepper, extra virgin olive oil, balsamic vinegar
Tortas De Aceite Y Anis,all - purpose flour, bread flour, invert sugar, water, active dry yeast, extra virgin olive oil, anise seed, sesame seeds, sea salt, sugar, anise oil, sugar
Low Cal Yogurt Breakfast,nonfat cherry yogurt, dried cherries, Post Grape - Nuts cereal
Wholemeal Bread,whole wheat flour, strong white flour, salt, water, dried yeast, olive oil, boiling water
Simple Vegan Blueberry Pancakes,whole wheat flour, baking powder, cinnamon, soymilk, blueberries
Asparagus In Its Own Juices Recipe,asparagus, unsalted butter, pepper
Microwave Peach Jam With Orange Liqueur,peaches, granulated sugar, lemon juice, orange liqueur
Baked Green Bean Casserole,butter, flour, salt, sugar, canned green beans, sour cream, gouda cheese, onions
Cabot Cheddar Cream Biscuits,flour, baking powder, salt, sharp cheddar cheese, heavy cream
Cream Cheese and Green Olive Dip - Teresa's Dip,cream cheese, sour cream, green olives, jars, Worcestershire sauce, lemon juice, garlic powder
Better Ranch Dressing,onion powder, dried parsley flakes, garlic powder, paprika, cayenne pepper, salt, black pepper, mayonnaise, milk
Homemade Butter Pecan Ice Cream,light cream, heavy cream, brown sugar, butter, pecan nuts, vanilla extract
Cinnamon Honey Fruit Gratin,sliced apples, swiss cheese, honey, ground cinnamon
Currant Griddle Scones,whole wheat pastry flour, baking powder, cinnamon, granulated sugar, margarine, rice milk, dried currants, walnuts
Potato Bread Starter Recipe,sugar, hot water, instant potato flakes
Onion & Garlic Popcorn,popcorn, butter, onion powder, garlic powder, salt
Savory Sausage Gravy,breakfast sausage, sliced mushrooms, yellow onions, garlic, flour, sugar, milk, black pepper, nutmeg, fresh basil
Brown Sugar Glaze,brown sugar, butter, whipping cream, icing sugar, light molasses
Oaty ginger crunch recipe,plain flour, baking powder, ground ginger, desiccated coconut, rolled oats, light brown sugar, butter, golden syrup, icing sugar, ground ginger, butter, golden syrup
Classic Pear Crisp,rolled oats, brown sugar, all - purpose flour, crystallized ginger, ground cinnamon, butter, white sugar, all - purpose flour, crystallized ginger, pears, vanilla ice cream
Nine Spice Garam Masala,coriander seeds, cloves, cumin seeds, brown cardamom pods, black peppercorns, nutmeg, cassia, bay leaves, ground ginger
Lemon Granita,water, sugar, lemon juice
Easy Basic Pancake (:,all - purpose flour, salted butter
Curried Mango Chutney Bread (Abm),water, butter, mango chutney, curry powder, sugar, salt, whole wheat flour, bread flour, yeast
Garlic & Dill Marinated Shrimp,cooked shrimp, butter, olive oil, garlic, dill weed, fresh lemon juice, shallots, salt, pepper, cayenne pepper
Raspberry Chocolate Chip Frozen Yogurt,plain yogurt, milk, heavy cream, honey, vanilla bean paste, fresh raspberries, semi - sweet chocolate chips
Lime Angel Food Cake,unbleached all - purpose flour, egg whites, lime zest, fresh lime juice, powdered sugar
Sugarplums,pitted dates, sultana raisins, currants, dried apricots, walnuts, orange liqueur, unsweetened flaked coconut
Bunuelos With Orange Syrup,brown sugar, cinnamon, orange juice, water, flour, sugar, salt, baking powder, cinnamon, vegetable shortening, orange juice, water
Bread Machine Cranberry Cornmeal Bread,water, water, molasses, butter, bread flour, cornmeal, salt, bread machine yeast, dried cranberries
Hot Chocolate Sauce over Pound Cake,sugar, unsweetened cocoa, all - purpose flour, salt, unsalted butter, vanilla extract
Outback Steakhouse Orange Dipping Sauce,orange marmalade, stone ground mustard, prepared horseradish, salt
Wacky Cake,all - purpose flour, unsweetened cocoa, white sugar, baking soda, salt, white vinegar, pure vanilla extract, vegetable oil, water
Best Cranberry Salad,cranberries, sugar, red grapes, 1 cup diced pineapple, , drained, pecans, whipped cream
Summer Cherry Sorbet,water, sugar, sour cherries
Buttered Noodles With Garlicky Bread Crumbs Recipe,egg noodles, butter, fresh white breadcrumbs, garlic, parsley, coarse salt
Strawberries in Meyer Lemon Syrup,strawberries, fresh meyer lemon juice, sugar, whipping cream
Emergency Spread,parmesan cheese, instant minced onion, mayonnaise
Mozzarella Pesto Spread,mozzarella cheese, pesto sauce, sun - dried tomatoes packed in oil
Mexican Wedding Cookies,butter, white sugar, vanilla extract, water, all - purpose flour, almonds, "confectioners sugar"
Buffalo Wings,chicken wings, butter, garlic powder, cayenne pepper sauce
Apple-Cinnamon Syrup,maple syrup, apple jelly, ground cinnamon, table salt
Apple and Blackberry Crumble,rome apples, brown sugar, lemon juice, water, blackberries, all - purpose flour, butter, granulated sugar, ground ginger
Chocolate Whipped Cream For Hot Chocolate,heavy cream, "confectioners sugar", vanilla extract, unsweetened dutch cocoa
Cantaloupe Granita,cantaloupe, fresh lime juice, agave nectar, salt
Make Your Own Boursin Cheese - Paula Deen,cream cheese, whipped butter, garlic salt, dried oregano, dried basil, dried dill, dried marjoram, black pepper, dried thyme
Plain Pastry (Pate Brisee),cake flour, salt, butter, vegetable shortening, ice water
Auntie Em s Layered Garden Salad,frozen broccoli florets, frozen cauliflower, cherry tomatoes, carrots, Italian salad dressing
Apples (Red Cinnamon) (Hot Pack) Recipe,sugar, water
1927 Peanut Butter Bread,flour, baking powder, salt, sugar, peanut butter, skim milk
Super Digestible Soaked Oatmeal - Nourishing Traditions,old fashioned oats, water, whey, sea salt, water, flax seeds, butter
2-Minute Eggless Microwave Chocolate Cake,all - purpose flour, unsweetened cocoa powder, vegetable oil, milk, granulated sugar, light brown sugar, baking powder, salt
BBQ Short Ribs,beef, salt, onions, vegetable oil, ketchup, pancake syrup, lemon juice, Worcestershire sauce, prepared mustard, black pepper
Delivery Men for Tobey...a Canine Treat,molasses, honey, water, vegetable oil, all - purpose flour, whole wheat flour, baking soda, cinnamon, ground cloves, ground ginger, raisins
Honey Ginger Lemon,vinegar, lemon juice, ginger juice, honey, hot water
Pita Bread,all - purpose flour, pastry flour, warm water, active dry yeast, applesauce, salt, white sugar, olive oil
Cottage Cream,cottage cheese, nutmeg, cinnamon, apricot nectar
Lentil Chili,water, salt, dry lentils, tomatoes, chili powder, cumin
Quick Enchilada Sauce,chili powder, flour, onion powder, garlic powder, cumin, tomato sauce, water
Papaya Atsara (Achara),papayas, salt, vinegar, ginger
White-Wheat Bread for the Bread Machine,warm water, honey, active dry yeast, canola oil, kosher salt, whole wheat flour, all - purpose flour, vital wheat gluten
Dana's Slow Cooker Chicken Tacos,boneless skinless chicken breasts, tomato sauce, salsa, taco seasoning
Easy Sour Cream Fruit Topping,KNUDSEN Sour Cream, honey, lemon juice
Mock Scones with Tofu and Pancake Mix For Dieters,firm tofu, pancake mix
Cheesy Popcorn,popcorn, margarine, Kraft macaroni and cheese
Johnny Iuzzini's Chocolate Soup,milk chocolate, cocoa, milk, juniper berries, bittersweet chocolate, heavy cream, cream, milk
Mom's Oriental Chicken,boneless skinless chicken breasts, orange marmalade, Dijon mustard, soy sauce
Cilantro Dressing,lime juice, white wine vinegar, honey, olive oil, cilantro
Balsamic Glazed Strawberry Parfaits,strawberries, balsamic vinegar, granulated sugar, vanilla ice cream
Quick Curried Chicken and Couscous,water, couscous, cream of chicken soup, water, curry powder, cooked chicken, frozen mixed vegetables
Sweetened Condensed Milk,powdered milk, sugar, water
Maple Roasted Squash,butternut squash, olive oil, salt, maple syrup, pumpkin pie spice, ground red pepper
Mock Apple Pie (Secret Zucchini Pie),oat flour, oatmeal, wheat flour, all - purpose flour, sugar, brown sugar, butter, applesauce, zucchini, lemon juice, water, sugar, cinnamon, nutmeg, ground cloves
Melanie's Pizza Dough,yeast, sugar, flour, olive oil, salt, water
Toffee Bars,butter, brown sugar, vanilla, all - purpose flour, semisweet chocolate pieces, california walnuts
Cola Cake (3 ingredients),pancake mix, sugar, cola
Wing Dings,maple syrup, catsup, soy sauce, dry mustard, ginger, garlic powder, chicken drummettes
Ben And Jerry's Sweet Cream Base Recipe,light cream, low - fat milk
Garlic and Oregano Pizza Dough,cake flour, water, yeast, salt, olive oil, oregano, garlic
Strawberry Filling (For Cakes and Cake Rolls),strawberries, strawberry Jell - O gelatin dessert, cornstarch, sugar, strawberry extract
Flax and Sunflower Seed Bread - Abm,water, butter, honey, bread flour, whole wheat bread flour, salt, bread machine yeast, flax seeds, sunflower seeds
Quick and Easy Fry Bread,flour, baking powder, salt, dry milk, hot water
Roasted Brussels Sprouts,Brussels sprouts, fresh thyme leaves, oregano leaves, pine nuts, garlic powder, kosher salt, fresh ground black pepper, olive oil, balsamic vinegar
Newlywed Biscuits,self - rising flour, sour cream, butter
Blueberry Kuchen Recipe,flour, sugar, salt, butter, white vinegar, blueberries, sugar, cinnamon, flour, blueberries, "confectioners sugar"
Salted Caramel Sauce,granulated sugar, unsalted butter, heavy cream, salt
Bread Dipping Oil,kosher salt, garlic, garlic powder, fresh parsley, fresh basil, fresh rosemary, fresh oregano, red pepper flakes, fresh ground black pepper, extra virgin olive oil, parmesan cheese
Raspberry Sorbet Recipe,granulated sugar, water, raspberries, fresh lemon juice
Spaghetti Squash Jam,spaghetti squash, granulated sugar, water
Linguica Con Queso (Cheese-Grilled Sausage),linguica sausage, cheese
Raisin Bran with Almonds,Raisin Bran cereal, PLANTERS Sliced Almonds, nonfat milk, water
Cherry Granola Bread,water, active dry yeast, vegetable oil, honey, salt, bread flour, whole wheat flour, nonfat dry milk powder, granola cereal, dried tart cherries
Minnesota Bars,canola oil, brown sugar, corn syrup, oatmeal, chocolate chips, peanut butter
Ham N Swiss Broccoli Quiche Recipe,pie crusts, flour
Mango Butter,mangoes, orange juice, lemon juice, water, sugar
Chinese Steamed Buns,active dry yeast, white sugar, all - purpose flour, water, warm water, all - purpose flour, salt, white sugar, vegetable oil, baking powder
Oyster Stew,oysters, celery, onions, pepper, Worcestershire sauce, butter, evaporated milk
Salt Pork And Greens Recipe,salt pork, water, beet leaves
BBQ pork ribs,garlic powder, brown sugar, chili powder, soy sauce, ketchup
Sea Salt With Fennel Seeds and Thyme,fennel seeds, dried marjoram, dried thyme, sea salt
Raspberry Curry Chili Sauce,frozen raspberries, honey, curry powder, chili powder
Raspberry-Lime Frappe,1/3 cup raspberry, lime juice, ginger ale, ice
Raspberry Horseradish Sauce,raspberry jam, apple jelly, dry mustard, prepared horseradish, coarse black pepper
Sour Cream-Mustard Sauce,sour cream, mayonnaise, coarse grain mustard, fresh dill, Worcestershire sauce, fresh coarse ground black pepper
Caramel Pecan Marshmallows Recipe,1/2 lb Caramel candy -- (vanilla), warm water, pecans, 1/2 lb Marshmallows -- (approximately 32)
Pama Sea Breeze,pomegranate liqueur, cranberry juice, grapefruit juice
Chocolate Crazy Cake,flour, sugar, cocoa powder, baking soda, salt, cold water, vegetable oil, vinegar, vanilla extract
Bleu Shew Truffles,blue cheese, cream cheese, parsley, shallots, ground black pepper, cashews
Wilton's Chocolate Buttercream Icing, Decorator Icing/Frosting,vegetable shortening, butter, cocoa, vanilla extract, "confectioners sugar", milk
Tropical Sherbet,sugar, water, pineapple, papayas, coconut milk, fresh lime juice, light corn syrup, salt
Pumpkin Butter III,solid pack pumpkin, applesauce, apple juice, brown sugar, pumpkin pie spice
Chicken Tikka Masala,water, beans and carrots vegetable mix, masala, cooked chicken, fresh cilantro, Minute Rice, water
Pineapple Ginger Sesame Sauce,apple juice, pineapple preserves, soy sauce, sesame oil, light brown sugar, powdered ginger
Spinach Tortillas,fresh spinach, all - purpose flour, whole wheat flour, baking powder, salt, lard, hot water
Mexican Chocolate Martini,chocolate vodka, chocolate liqueur, coffee - flavored liqueur, cinnamon schnapps
Make-up Remover,coconut oil, olive oil, avocado oil
Bread Machine Sourdough,water, low - fat plain yogurt, lemon juice, margarine, flour, salt, yeast, bread enhancer
Low Fat Honey Banana Bread,whole wheat flour, brown sugar, baking powder, baking soda, pumpkin pie spice, bananas, honey, low - fat milk
Tuscan Pea & Snap Pea Medley,sugar snap peas, frozen peas, Italian dressing
Chocolate Truffles,cream, white chocolate, butter, dark chocolate, coconut
Soy Biscuits,flour, salt, vegetable shortening, low - fat milk, baking soda
Ginger tea (eee /Saenggang-cha),gingerroot, honey
Sweet and Spicy Pecans,water, Worcestershire sauce, garlic salt, cayenne pepper, pecans
Homemade Nutella,hazelnuts, milk chocolate chips, canola oil, powdered sugar, pure vanilla extract, salt
Potatoes Anna,butter, salt, potatoes
Colonel Sanders' Kentucky Whipped Butter,butter, buttermilk
Perfect Pickled Beets,beets, beets, granulated sugar, white vinegar, pickling salt, ground cloves
Three Seed Bread (From Bread Machine to Oven),skim milk, honey, canola oil, unbleached white flour, whole wheat flour, salt, ground flax seeds, sunflower seeds, poppy seeds, active dry yeast
Frico,parmesan cheese, ground black pepper, flour
Tomato, Basil, and Flax Crackers,sunflower seeds, sun - dried tomatoes, flax seeds, tomatoes, fresh basil, celery, dates, jalapeno peppers, olive oil, salt
Beans Slow Cooker Style Recipe,16 ounce dry beans rinsed and picked over, warm water
Monkey Mix,semi - sweet chocolate chips, peanut butter, butter, vanilla extract, Chex cereal, icing sugar
Oatmeal Cookies,oatmeal, spelt flour, honey, milk, oil
Green Beans With Olive Oil,green beans, olive oil, sea salt
Cheese Sauce,butter, cornflour, milk, cheese, dry mustard, salt, pepper
Italian Wheat Bread With Pesto,water, honey, salt, pesto sauce, whole wheat flour, unbleached flour, vital wheat gluten, active dry yeast
Acapulco Gold Mocktail,pineapple juice, grapefruit juice, coconut milk, cream
Grannies Shortbread Cookies,real butter, powdered sugar, cornstarch, all - purpose flour
Double Chocolate Mexican Brownie Pancakes,buttermilk pancake mix, unsweetened cocoa, granulated sugar, cinnamon, water, walnuts, semi - sweet chocolate chips
Caramelized Onion Mashed Potatoes,olive oil, onions, baking potatoes, fat - free buttermilk, butter, salt, black pepper
Oven Baked Flat Breads,active dry yeast, warm water, olive oil, sugar, sour cream, salt, whole wheat flour, all - purpose flour
Smirnoff Red Apple,Smirnoff Green Apple Flavored Vodka, cranberry juice
Celery Roquefort Soup,butter, onions, celery, water, milk, Roquefort cheese, low - fat cream cheese, salt, pepper
Strawberry Shots,fresh strawberries, semisweet chocolate, strawberry vodka
Brittes Chocolate Cake Recipe,unbleached all - purpose flour, granulated sugar, unsweetened cocoa, baking soda, salt, mayonnaise, hot water, vanilla extract
Spring Ginger Pickled in Sweet Vinegar (Gari/Sushi Ginger),gingerroot, vinegar, sugar, honey, salt
Cilantro lime marinade,oil, lime juice, garlic powder, cilantro, black pepper, salt, chili powder
Pink Smoothie,ice, milk, old fashioned oats, Greek yogurt, honey, frozen strawberries
Pecan Pancake Syrup,pancake syrup, pecans
North Carolina Brown-Butter Sweet Potatoes,sweet potatoes, butter, light molasses, salt
Knightens Cocoa Cake Frosting,butter, cocoa, powdered sugar, milk, vanilla extract
Alice's Fondant Filling for Chocolates,sugar, cream, light Karo syrup
Honey Mustard Soup With Chicken,cooked chicken, chicken broth, honey mustard, frozen baby peas, heavy cream, cornstarch
Dinner Rolls in One Hour,all - purpose flour, fast rise yeast, instant nonfat dry milk powder, sugar, salt, water, extra virgin olive oil, unsalted butter
Baked Cranberry Oatmeal,skim milk, brown sugar, margarine, ground cinnamon, old fashioned oats, apples, dried cranberries, pecans
Irish Potato Bake,Corn Chex, butter, mashed potatoes, sour cream, onion powder, seasoning salt, white pepper, frozen broccoli, shredded cheddar cheese
Caramelised Onion Hummus,butter, onions, brown sugar, chickpeas, lemon juice, tahini, olive oil
Sweet Pickle Relish,cucumbers, onions, red peppers, green peppers, salt, water, sugar, vinegar, celery seeds, mustard seeds
Hot Cocoa Mix,"confectioners sugar", cocoa powder, powdered milk, salt, cornstarch, cayenne pepper
Sesame Cardamom Tea Cookies,flour, ground cardamom, salt, baking powder, margarine, white sugar, brown sugar, tahini, vanilla extract, sesame seeds, fresh ginger
Chili and Spice Seasoning,paprika, dried oregano, chili powder, garlic powder, black pepper, cayenne pepper, dry mustard
Watermelon Lemonade,seedless watermelon, fresh lime juice, sugar
Romaine & Strawberry Salad,romaine lettuce, fresh strawberries, red onions, slivered almonds, honey, balsamic vinegar
Coleslaw With Honey,cabbage, carrots, sweet onions, mayonnaise, honey, milk, buttermilk, white vinegar, lemon juice, kosher salt, fresh ground pepper
Cheesy Cracker Pretzels,flour, parmesan cheese, salt, butter, sharp cheddar cheese, cold water
A Bucket of Bran Muffins,all - bran cereal, boiling water, sugar, applesauce, egg substitute, whole wheat pastry flour, baking soda, salt, buttermilk
Baked Onion Dip Recipe,onions, shredded cheddar cheese, mayonnaise
Apple Cider Fondue,apple cider, mozzarella cheese, provolone cheese, flour, garlic powder, onion powder
Roasted Pumpkin Seeds and Pumpkin,water, salt, pumpkin seeds, unsalted butter
Powdered milk yoghurt,powdered milk, hot water, yoghurt
Rolls,milk, yeast, sugar, warm water, salt, oil, flour, dark molasses, flour
Saskatoon Pie Filling,water, lemon juice, saskatoon berries, sugar, cornstarch
Rocky Road Sauce,dark chocolate, cream, marshmallows, glace cherries, mixed nuts
Cooked Peanut Butter Icing (Frosting),sugar, milk, light corn syrup, margarine, peanut butter, vanilla flavoring
Natural Fruit and Veggie Wash,water, lemon juice, baking soda
Golden Almond Popcorn,butter, light corn syrup, brown sugar, salt, pure vanilla extract, baking soda, natural almonds, popped popcorn
Peanut Butter Nuggets,cereal, shredded coconut, creamy peanut butter, honey
Raspberry Walnut Vinaigrette,honey mustard, raspberry vinegar, walnut oil, olive oil, tarragon leaves, salt
Haupia with Pineapple,coconut milk, water, sugar, cornstarch, fresh pineapple
New York Deli-Style Bagels,active dry yeast, granulated sugar, warm water, bread flour, salt
Green Herb Rice,green onions, fresh dill, fresh parsley, fresh cilantro, butter, cooked rice
Rosy Pineapple Ice,unsweetened pineapple juice, honey, cranberry juice cocktail
Perfect Strawberry Milkshake,frozen strawberries, milk, vanilla ice cream
Oatmeal Butter Crackers,flour, rolled oats, salt, sugar, butter, milk
Chocolate Peanut Butter Oatmeal Protein Bars,chocolate whey protein powder, old fashioned oats, natural - style peanut butter, honey, cocoa powder, ground cinnamon, water
Mint Chocolate Ice Cream Cake,chocolate sandwich style cookies, unsalted butter, mint chocolate chip ice cream, ice cream, mint chocolate chips
Spicy Glazed Carrots,vegetable oil, carrots, brown sugar, ground cinnamon, cayenne pepper, nutmeg
Creole Seasoning,dried oregano, salt, garlic powder, black pepper, cayenne pepper, dried thyme, paprika, onion powder
Baked Black Beans And Sausage Recipe,black turtle beans, chicken, smoked sausage, onions, salsa, molasses, brown sugar, dry mustard, salt, pepper, cornstarch, water
Blueberry Ice Tea Recipe,tea
Frozen Strawberry Banana Margaritas,bananas, orange juice, ice, tequila, lime juice
Sesame Asparagus,asparagus spears, vegetable oil, rice vinegar, sesame seeds, sugar, soy sauce
Spicy Apricot Wings,apples, apricot preserves, Worcestershire sauce, light brown sugar, soy sauce, Dijon mustard, kosher salt, fresh ground black pepper, garlic powder, sweet paprika, cayenne pepper, ground ginger, chicken wings
Mile High Multigrain Bread,hot water, olive oil, sugar, salt, instant yeast, multi - grain flour, all - purpose white flour, butter
Grandpop Tom's Egg Cream,whole milk, "Hersheys syrup", club soda
Hawaiian Stir-Fry,pineapple juice, soy sauce, ground ginger, garlic powder, cornstarch, sugar, vegetable oil, onions, green peppers, carrots, broccoli, cauliflower, sliced water chestnuts, sliced mushrooms, Chinese cabbage
Jerry's Wings,vegetable oil, chicken wings, butter, hot pepper sauce
Apple Butter,apples, maple syrup, ground cinnamon
Lillehamar Cream Melts,flour, sour cream, butter, powdered sugar, milk
Chocolate Pizza,vanilla chips, semi - sweet chocolate chips, miniature marshmallows, Rice Krispies, walnuts, maraschino cherries, flaked coconut, vegetable oil
Carrot Raisin Muffins,raisins, young fresh baby carrots, almond milk, honey, yogurt, canola oil, sugar, oat bran, all - purpose flour, whole wheat flour, wheat germ, nutmeg, baking powder, salt, cinnamon, sunflower seeds
Chocolate-Dipped Coconut Macaroons (Great for Passover),unsweetened coconut, coconut cream, salt, coconut, coconut milk powder, semi - sweet chocolate chips, butter, light corn syrup
Summer Spinach and Strawberry Salad,Baby Spinach, fresh strawberries, goat cheese, slivered almonds, extra virgin olive oil, orange juice, orange zest, white wine vinegar, kosher salt, fresh ground black pepper
Cilantro Lime Mustard,stone ground mustard, lime juice, cilantro, ground cumin
Merguez Bites,olive oil, chorizo sausage
Florida Coconut Pralines,sugar, shredded coconut, water
Sorbet -- No Ice Cream Maker Needed!,frozen strawberries, plain yogurt, sugar
Roasted BBQ Chicken with Red Devil Rub,chicken parts, honey, Worcestershire sauce, paprika, curry powder, chili powder, salt, black pepper, cayenne pepper
Salt and Pepper Chocolate,bittersweet chocolate, white chocolate, chili powder, sea salt
Crazy Bread,flour, yeast, salt, warm water, sugar
Cranberry Cinnamon Bread (Bread Machine),water, butter, sugar, salt, bread flour, dry yeast, cranberries, cinnamon, water, butter, sugar, salt, bread flour, dry yeast, cranberries, cinnamon
Almond, Date & Coconut Cookies,almond flour, oats, baking powder, desiccated coconut, dates, fresh ginger, ginger powder, coconut oil, maple syrup, almond milk
Italian Herb Grilled Chicken,dried oregano, dried thyme, dried basil, garlic powder, kosher salt, fresh ground pepper, chicken breasts, olive oil
Pizza Dough,flour, dry active yeast, water, salt, olive oil, sugar
Easy Mexican Bread Pudding,brown sugar, cinnamon, French bread cubes, raisins, walnuts, sharp cheddar cheese, butter
Baked Lentil Munchies,lentils, water, oil, kosher salt, garlic spread, curry powder, hot chili powder
Curry-Lime Yogurt,plain yogurt, curry powder, fresh lime juice
Everyday Seasoning,pepper, "Lawrys Seasoned Salt", onion powder, garlic powder
Christmas Crack (aka Clodhoppers),Golden Grahams cereal, dried cranberries, slivered almonds, white chocolate pieces
Awesome Blueberry Sauce with Orange Zest,frozen blueberries, sugar, water, oranges
Kicked Up Fried Almonds,olive oil, blanched almonds, paprika, cayenne, garlic powder, salt
The Ultimate Indulgent Hot Cocoa For Two,unsweetened cocoa powder, cornstarch, sugar, salt, half - and - half, vanilla extract
Lemon Sorbet with Blackberry Sauce,frozen unsweetened blackberries, sugar, lemon sorbet
Sue's Somersized Muffins,whole wheat flour, oats, Splenda sugar substitute, baking powder, baking soda, salt, nonfat milk, fat free sugar free yogurt, blueberries
Gourmet Chocolate Syrup,dark cocoa, sugar, sea salt, cold water, corn syrup, butter, vanilla
Fried Mushrooms,pancake mix, water, whole mushrooms
Caramel Corn,popped popcorn, brown sugar, butter, corn syrup, salt, baking soda
Honey Poppy Vinaigrette,olive oil, honey, red wine vinegar, fresh lemon juice, Dijon mustard, poppy seeds, garlic granules, cayenne pepper, salt, pepper
Low carb maple cream cheese frosting,cream cheese, butter, sugar - free maple syrup
Cream Soup From Scratch Recipe,1 c. nonfat dry lowfat milk pwdr, dry onion flakes, cornstarch, chicken bouillon, dry basil, dried thyme, black pepper
Maple-Cinnamon Almond Butter,3 cups Whole, Raw Almonds, maple sugar, ground cinnamon, coconut oil, sea salt
Apple Streusel Squares,pecans, light brown sugar, butter, vanilla extract, ground cinnamon, flour, white sugar, salt, butter, butter, apples, dark raisins, light brown sugar, ground cinnamon, cornstarch, fresh lemon juice
Peppermint-Mini Marshmallow Bark,white chocolate, peppermint candies, mini marshmallows
