title,ingredient_list
Strawberry Tofu Smoothies,unsweetened apple juice, frozen unsweetened strawberries, firm tofu, sugar
Strawberry Bomb (Cocktail Drink),strawberry cream liqueur, vodka, strawberry schnapps
Wonderful Dinner Rolls,water, molasses, vegetable oil, flour, oatmeal, salt, bread machine yeast
Rice Flour Pancakes,brown rice flour, baking powder, cream of tartar, dates, salt, cooked brown rice, soymilk, vegetable oil
Sea Salt and Honey Almond Butter,roasted almonds, sea salt, honey
Chocolate Rock,semisweet chocolate, milk chocolate, vegetable oil, pecan halves, white chocolate
Crispy Chicken Wings,chicken wings, vegetable oil, soy sauce, sugar, salt, Chinese five spice powder, water, flour, cornstarch, baking soda
Ground Beef, Spinach and Barley Soup,lean ground beef, water, stewed tomatoes, carrots, onions, quick - cooking barley, beef bouillon granules, dried thyme leaves, dried oregano leaves, garlic powder, black pepper, salt, spinach leaves
Light-Wheat Sandwich Bread,warm water, white sugar, bread machine yeast, applesauce, white flour, wheat flour, salt
Ginger Syrup,fresh ginger, water, sugar
Creamed Chipped Beef Recipe,chipped beef, butter, flour, low - fat milk
Almond Splinters,chocolate milk, slivered almonds
Fried Apples,canola oil, baking apples, lemon juice, unsweetened apple juice, honey, cinnamon, nutmeg, water, cornstarch
Slow Cooker Potatoes Au Gratin by Kim,red potatoes, butter, all - purpose flour, salt, black pepper, black pepper, milk, mild cheddar cheese, sharp cheddar cheese, colby - monterey jack cheese
Yogurt,milk, yogurt
Thanksgiving Beets,beets, brown sugar, vinegar, water, cornstarch, ground cinnamon, ground nutmeg, ground cloves, butter
Aloha Carrots,baby carrots, water, salt, brown sugar, crushed pineapple, butter
Jamaican Ginger Pralines,granulated sugar, baking soda, buttermilk, light corn syrup, powdered ginger, unsalted butter, dark rum, pecans
Pecan Praline Topping,butter, brown sugar, whipping cream, vanilla extract, pecans, rum
Quick Breakfast Blueberries,frozen blueberries, maple syrup, Grape - nuts cereal, whipped cream
Simply Spicy Potato Pesto Samosas #5FIX,pesto sauce, red pepper flakes, Simply Potatoes Diced Potatoes with Onion, light sour cream, refrigerated pie crusts
Perfect Pie Crust (Very Detailed Instructions),all - purpose flour, salt, sugar, unsalted butter, ice water, red wine vinegar
Piadine Romagnole (Italian Flatbread),flour, olive oil, baking soda, salt, milk, water
Barbecue Sauce,ketchup, apple cider, Worcestershire sauce, molasses, cider vinegar, brown sugar, yellow mustard, black pepper, cayenne pepper
Nora's Firecrackers,butter, cheddar cheese, flour, salt, cayenne
Dairy Base for Frozen Glace,part - skim ricotta cheese, nonfat yogurt, maple syrup, vanilla extract
Date Roll Candy,sugar, milk, dates, pecans
Biscuits All Covered In Gravy,flour, baking powder, salt, milk, butter, breakfast sausage, flour, butter, milk, salt, pepper, soy sauce
Pomegranate Dessert,pomegranates, rose water, lemon juice, white sugar
Onion Tarka,cooking oil, dried onion flakes
Pie Crust,unsalted butter, vegetable shortening, cake flour, all - purpose flour, sugar, kosher salt, cold water
Pea Puree for Baby,frozen peas, chicken broth
Three Bees Sprouts,Brussels sprouts, bacon, butter, salt, pepper
Puppy Chow,peanut butter, chocolate chips, butter, Crispix cereal, peanuts, powdered sugar
Tamarind Cooler,tamarind pods, water, sugar, ice
Cream Soda Cocktail,vanilla vodka, ginger ale
Homemade Paneer (Indian Cottage Cheese),whole milk, yogurt
Spiced Rice,long grain rice, water, onions, olive oil, honey, reduced - sodium chicken broth, golden raisins, curry powder, salt, ground cumin, ground cinnamon, red bell peppers
Corn Dodgers,yellow cornmeal, salt, butter, boiling water
Maple Bacon Cheddar Burgers,maple bacon, ground beef, sharp cheddar cheese, onions, "McCormicks Montreal Brand steak seasoning"
Candied Pecans Recipe,butter, brown sugar, cinnamon, cloves, pecan halves
Three Berry Smoothie,strawberries, blueberries, raspberries, raspberries, buttermilk, whipped cream, sugar
Whole-Grain Blueberry Scones,spelt flour, baking powder, salt, baking soda, ground cinnamon, ground nutmeg, white sugar, butter, blueberries, buttermilk, glaze
Sweet and Easy Cholent,vegetarian baked beans, ketchup, mustard
Basic Sugar Glaze,"confectioners sugar", water
Philippine Grilled Pork Tenderloin,pork tenderloin, white vinegar, soy sauce, garlic, fresh ground black pepper, hot red pepper flakes
Shortbread Hammer Placecards,unsalted butter, sugar, pure vanilla extract, all - purpose flour, salt, "confectioners sugar", corn syrup, fresh lemon juice
Green Barley Recipe,pearl barley, salt, water
Papaya Lemonade,sugar, boiling water, cold water, papayas, fresh lemon juice
Amish White Bread,warm water, white sugar, active dry yeast, salt, oil, bread flour
Tomato, Basil, Pine Nut Dressing,olive oil, balsamic vinegar, sun - dried tomatoes, fresh basil leaves, pine nuts, water, white sugar
Pumpkin Pie Spice II,ground cinnamon, ground nutmeg, ground ginger, ground cloves
Soda Bread With Walnuts and Raisins,whole wheat flour, unbleached all - purpose flour, baking soda, fine sea salt, walnuts, golden raisins, buttermilk
Crystallized Ginger Ice Cream,vanilla ice cream, crystallized ginger, cinnamon
Thanksgiving Dessert Recipe,flour, butter, pecans
Piglet's Haycorn-Popcorn Balls,sugar, honey, water, butter, popped popcorn
Country Oatmeal Cookies in a Jar,all - purpose flour, baking powder, salt, semi - sweet chocolate chips, brown sugar, white sugar, rolled oats
Raspberry Buttermilk Sherbet,frozen raspberries, sugar, buttermilk
Creamy Spinach Soup with Fontina Toast,frozen chopped spinach, Fontina cheese
Ground Beef Vegetable Fricassee Recipe,onions, celery, ground beef, flour, warm water, salt, black pepper, onion salt, garlic salt
Walnut Pastries Recipe,flour, butter, cream cheese
Vegan Nutella,nut butter, semisweet vegan chocolate chips, soymilk powder
Lilla's" to Die for " Chicken Wings,chicken wings, soy sauce, ketchup, honey, vodka, garlic granules
Peanut Butter Fudge Sauce,light corn syrup, creamy peanut butter, heavy cream, semi - sweet chocolate chips
Cajun Mayonnaise Dipping Sauce,mayonnaise, lemon juice, cayenne pepper, garlic powder, onion powder, pepper, paprika, dried thyme, dried oregano, salt
Chili Fruit Salad,cider vinegar, sugar, crushed red pepper flakes, seedless watermelon, fresh pineapple, fresh strawberries
Easy Berry Freezer Jam,strawberries, sugar, dry pectin, water
Simple Whole Wheat Bread,mineral water, olive oil, maple syrup, whole wheat flour, ground flax seeds, wheat gluten, salt, active dry yeast
Raspberry Balsamic Dressing,olive oil, balsamic vinegar, raspberry preserves, onion powder, ground black pepper, salt
Toasted Winter Squash Seeds,seeds, salt, olive oil
Oven Roasted Asparagus Corn Meal Crackers,wheat flour, yellow cornmeal, sea salt, unsalted butter, asparagus, 1% low - fat milk
Instructions for Cleaning & Care for Your Wok,cooking oil, hot water
Creamy Yogurt Honey Poppy Seed Vinaigrette,canola oil, champagne vinegar, honey, sea salt, Dijon mustard, poppy seeds, plain yogurt, shallots
Peanut Grillers,1 cup PLANTERS Dry Roasted Peanuts Rite Aid Buy 1 Get 1 Free thru 02/06
Lemonade Scones (Australian),flour, cream, lemonade
BBQ Shrimp,"1 lb. uncooked medium shrimp, peeled with tails left on, deveined King Soopers 1 lb For $7.99 thru 02/09", barbecue sauce
Hot Cocoa Mix,cream, milk, sugar, cocoa powder
Maple Walnut Brownies,flour, cocoa powder, salt, maple syrup, apple juice, oil, vanilla extract, walnuts
Cajun Seasoning Mix,salt, paprika, onion powder, garlic powder, cayenne pepper, white pepper, thyme, black pepper, oregano
Orange Bread,active dry yeast, warm water, sugar, orange zest, salt, baking soda, milk, butter, orange juice, flour
Thousand Island Dressing (Homemade),mayonnaise, oil, vinegar, ketchup, sugar, salt, dried parsley flakes, paprika, garlic powder
Artichoke And Bacon Salad Recipe,jerusalem artichokes, parsley, walnut oil, extra virgin olive oil, lemon juice, Dijon mustard
Amaretto Lemonade Recipe,lemonade mix
Chocolate Malted Ice Cream,heavy whipping cream, whole milk, instant malted milk powder, granulated sugar, unsweetened cocoa powder, light corn syrup, kosher salt, nonfat dry milk powder, cornstarch, pure vanilla extract, malted milk balls
Apple N Spice Loaf,apple juice, sugar, oil, cinnamon, cloves, nutmeg, raisins, apples, flour, baking powder, pecans
Creamed Mashed Potatoes with Spinach,boiling potatoes, heavy cream, unsalted butter, salt, black pepper, Baby Spinach
Cranberry Fluff,tart apples, green seedless grapes, pecan pieces, fresh cranberries, whipping cream, sugar, marshmallows
Rum Or Bourbon Balls Recipe,vanilla wafers, "confectioners sugar", pecans, cocoa, light corn syrup, rum, sugar
Whiskey Mustard,yellow mustard seeds, black mustard seeds, water, flour, cayenne, cider vinegar, whiskey, honey, nutmeg, salt
Almond Shortbread Cookies,sliced almonds, all - purpose flour, almond meal, kosher salt, almond butter, coconut oil, granulated sugar, turbinado sugar, pure vanilla extract
Nif's Grilled Hawaiian Chicken Skewers,boneless skinless chicken breasts, fresh pineapple, red peppers, soy sauce, rice vinegar, canola oil, brown sugar, garlic, ginger, dry mustard
Hendrick's Gin and Tonic,gin, tonic water
Zucchini and Pecan Saute,butter, pecans, fresh zucchini, parmesan cheese
Coco Hemp Butter,hemp seeds, cocoa powder, honey, coconut oil, salt
Easiest Blue Cheese Dip,plain yogurt, blue cheese
Feta Cheese and Olive Bread,buttermilk, feta cheese, olive oil, sugar, salt, bread flour, bread machine yeast, Greek olives
Chocolate Crispy Bites,butter, chocolate, chocolate chips, rice bubbles, chocolate sprinkles
Oven-Baked Fish Sticks,halibut fillets, milk, plain breadcrumbs, panko breadcrumbs, kosher salt, fresh cracked pepper
Diabetic, Crunchy Chocolate Raisin Fudge,margarine, 113 cup milk, skim, (non fat) powder, cocoa powder, sugar, evaporated milk, vanilla extract, crisp rice cereal, raisins
Beer And Cheese Soup (Washington) Recipe,butter, celery, carrots, onions, all - purpose flour, dry mustard, thyme leaves, chicken stock, sharp cheddar cheese, parmesan cheese, pretzels
Fudgsicles (Frozen Fudge Pops),sweetened condensed milk, sugar, unsweetened cocoa powder, low - fat milk, vanilla extract
Lean Pork Breakfast Patties,all - bran cereal, apple juice, pork loin, fennel seeds, dried rosemary leaves, salt, hot pepper flakes
Basic French Dough Recipe,hot water, sugar, salt, yeast
Apricot Cheese Spread Recipe,cream cheese, seasoning salt, apricot preserves, green onions, dry roasted peanuts
Barefoot Contessa's Parmesan Black Pepper Crackers -Ina Garten,butter, parmesan cheese, all - purpose flour, kosher salt, fresh thyme leaves, fresh ground black pepper
Cuban Bread Kitchenaid,yeast, warm water, salt, sugar, bread flour
Ginger-Pickled Red Cabbage,red cabbage, pickled ginger, pickled ginger, black sesame seeds
Avocado Ranch,avocados, mayonnaise, sour cream, buttermilk, white vinegar, salt, dried parsley, onion powder, dried dill weed, garlic powder, pepper
Cranberry and Pecan Bircher Muesli (With Variation),rolled oats, skim milk, vanilla beans, cranberries, pecans
Nine-Grain Bread Abm,water, butter, brown sugar, salt, seven - grain cereal, bread flour, yeast
Scharffenberger Homemade Chocolate Liqueur,unsweetened cocoa powder, boiling water, granulated sugar, water, vodka, heavy cream
Creamed Potatoes,white potatoes, salt, milk, butter
Chapatis (Indian or Kenyan Wholewheat Flatbread),whole wheat flour, salt, water
Orange-Date Oat Bars,orange juice, dates, orange zest, ground cinnamon, old fashioned oats, all - purpose flour, dark brown sugar, baking soda, salt, vegetable shortening, pecans
Golden Onion Soup,onions, butter, all - purpose flour, chicken broth, milk, mozzarella cheese
Red Lobster Style Cheddar Biscuit,pancake mix, butter, cheddar cheese, milk, garlic powder, butter, garlic powder, parsley, salt
Apple and Pear Salad,red apples, pears, bananas, lemon juice, walnuts, raisins, mayonnaise, orange juice
Wholegrain Spelt Bread with Flax and Sunflower Seeds (Slow-rise),spelt flour, water, active dry yeast, spelt flour, water, salt, spelt flour, bread flour, active dry yeast, butter, honey, unsalted sunflower seeds, flax seeds, raisins
Nut Butter Pudding,milk, cornstarch, sugar, nut butter
Montreal Steak Seasoning,garlic powder, coriander seeds, coarse salt, dill weed, paprika, crushed red pepper flakes, fresh ground black pepper
Hand-Kneaded Bread with Vegetable Oil,bread flour, salt, sugar, dry yeast, milk, heavy cream, canola oil
Chocolate Monkey Bread,semisweet chocolate, sugar, Dutch - processed cocoa powder, all - purpose flour, instant yeast, water, all - purpose flour, salt, sugar, vanilla extract, unsalted butter, "Bakers Special Dry Milk", potato flour, butter, milk, chocolate chips
Homemade Brown Sugar,sugar, unsulphured molasses
Taffy Float,molasses, vanilla ice cream, milk
"Never Weep" Whipped Cream,whipping cream, vanilla instant pudding mix, powdered sugar, vanilla extract
Refreshing Watermelon Lemonade,watermelon, sugar, fresh lemon juice, cold water
Gala Salsa,red pear tomatoes, diced onions, jalapenos, garlic granules, cumin, cilantro
Vanilla Oatmeal No-Bake Cookies,sugar, butter, milk, vanilla instant pudding mix, quick - cooking oats, vanilla extract
Curried Scallops With Spinach,rotini pasta, margarine, green onions, curry powder, tomato paste, fat - free low - sodium chicken broth, evaporated skim milk, spinach, scallops, olive oil, canned tomatoes
Japanese Salad Dressing,mayonnaise, soy sauce, garlic, powdered ginger, rice wine vinegar, sesame oil, milk
Yummy Creamed Corn,frozen corn, whipping cream, salt, sugar, cornstarch
Homemade Yogurt,water, dry milk, milk, yogurt
Glazed Baby Carrots - Dump OAMC,carrots, orange juice, brown sugar, butter, fresh dill, salt, cornstarch
Pecan Sandies,pecan pieces, all - purpose flour, kosher salt, baking powder, butter, turbinado sugar, pure vanilla extract
Cranberry-Apricot Sauce,cranberries, dried apricot halves, unsweetened applesauce, water, fruit jelly
Cranberry Soda Bread,dried cranberries, Irish whiskey, bread flour, baking soda, salt, caraway seeds, unsalted butter, honey, buttermilk
Old Fashioned Barley Mushrooms,vegetable oil, onions, bell peppers, sliced mushrooms, water, barley, salt, black pepper
Cheddar and Chive Scones,all - purpose flour, sugar, baking powder, salt, butter, heavy cream, cheddar cheese, fresh chives
Atk Shortbread,flour, "confectioners sugar", salt, cornstarch, old fashioned oats, unsalted butter
Plum Preserves,plums, sugar, water
Caramel Candy Popcorn Balls Recipe,brown sugar, water, low - fat milk, popped corn
Hop, Skip, and Go Naked,vodka, gin, rum, sloe gin, orange juice, powdered sugar
Gluten Free Breakfast Bars,almond flour, sea salt, baking soda, grapeseed oil, agave nectar, vanilla extract, shredded coconut, pumpkin seeds, sunflower seeds, slivered almonds, raisins
Creamy Cucumber Dressing,cucumbers, mayonnaise, buttermilk, dried dill, dried chives, dried parsley, fresh lemon juice, salt, white pepper, garlic powder
Easy Oatcakes,oatmeal, flour, baking powder, salt, butter, honey, 60 ml buttermilk (or 2 Tbsp milk + 2 Tbsp plain yoghurt)
Icelandic Skyr,water, non - fat powdered milk, buttermilk
Pickle Stuffing,soft breadcrumbs, salt, pepper, dill pickles, onions, parsley, butter
Connie's Candied Cranberries,granulated sugar, water, fresh cranberries, superfine sugar
Simple Basil Paste,fresh basil leaves, olive oil, salt
Fish Baked in Coconut Milk,steaks, fresh lemon juice, vegetable oil, onions, vegetable oil, garlic, minced ginger, jalapenos, fresh tomatoes, ground coriander, ground cumin, ground red pepper, ground black pepper, ground turmeric, fennel seeds, salt, canned unsweetened coconut milk, cilantro
Grapefruit & Yogurt Pops,plain low - fat yogurt, grapefruit sections, grapefruit zest, lemon extract, powdered sugar
Holiday-Spiced Roast Beef,ground cinnamon, ground cloves, fresh ground black pepper, boneless beef top round, olive oil, salt, apple cider
Pizza Dough,yeast, sugar, warm water, flour, salt, oregano, dried basil, olive oil
Cream Cheese Frosting / Icing for Cookies,cream, butter, cream cheese, powdered sugar
Simple Flaky Pastry,unbleached all - purpose flour, salt, baking powder, vegetable shortening, water
Orange Rum Sauce,sugar, cornstarch, salt, orange juice, amber rum, vegetable shortening, pure vanilla extract
Butter-Glazed Asparagus,Swanson chicken broth, asparagus, butter
Curried Quinoa Salad With Mango,quinoa, canola oil, white wine vinegar, mango chutney, curry powder, dry mustard, mangoes, English cucumbers, green onions, Baby Spinach
Panch Phoron - Indian 5-Spice,nigella seeds, black mustard seeds, fenugreek seeds, fennel seeds, cumin seeds
Grape Dumplings,flour, baking powder, sugar, salt, shortening, grape juice
Stovetop Berry Crumble,strawberries, blueberries, cornstarch, water, stevia, rolled oats, cinnamon, butter, stevia
Hazelnut Brittle,hazelnuts, unsalted butter, sugar, light corn syrup, baking soda, table salt
Raspberry Truffles,semisweet chocolate, butter, cream, raspberry jam, lemon juice, cornstarch, semisweet chocolate, semisweet chocolate, cocoa, nuts
Wheat Rolls,water, orange juice, unsalted butter, honey, whole wheat flour, unbleached all - purpose flour, salt, potato flakes, nonfat dry milk powder, instant yeast, unsalted butter
Chocolate Caramel Oatmeal Bars,caramels, evaporated milk, self - rising flour, baking soda, brown sugar, oatmeal, butter, chocolate chips, pecans
American Blueberry Crumble,unsalted butter, blueberries, granulated sugar, cornstarch, orange juice, vanilla extract, all - purpose flour, brown sugar, granulated sugar, unsalted butter, oats, toasted almonds, ground cinnamon
Chocolate Gravy,sugar, flour, Hersheys cocoa powder, water
Peanut Butter Dog Treats,whole wheat flour, skim milk, organic peanut butter, baking powder
A.1. Roasted Potatoes,olive oil, peppercorns, yukon gold potatoes
Pomegranate Sunrise,pomegranate juice, orange juice, tequila
Chocolate Sauce (Raw),cocoa powder, agave nectar, smooth cashew butter, vanilla essence
Simple Stuffed Roast Turkey,whole turkey, kosher salt, turkey fat, peanut oil
Sausage Balls,sausage, self - rising flour, shredded cheddar cheese, powdered milk, onion powder, garlic powder, pepper, celery seeds
Grilled Asparagus,asparagus, balsamic vinegar, fresh lemon juice, olive oil, low sodium soy sauce, black pepper
Pumpkin Peach Smoothie,canned pumpkin puree, peaches, sugar, low - fat milk, vanilla Greek yogurt, cinnamon, nutmeg, ice
Roasting Pork Shoulder and Beef Chuck,vegetable oil, salt, fresh ground black pepper, boneless pork shoulder, boneless beef chuck roast
Marshmallow Goof Balls,marshmallows, caramel candies, butter, condensed milk, crispy rice cereal
Baked Sweet Potato Chips,sweet potatoes, sugar, lemon juice, lowfat margarine, pepper
Peanuts & Cherries,dry roasted peanuts, dried cherries, nonfat milk
Homemade Light Pudding,sugar, cocoa powder, cornstarch, skim milk, vanilla extract
Montana Winter Spiced Cider,brown sugar, cinnamon, vanilla ice cream, butter, apple cider
Cauliflower with Lemon-Caper Vinaigrette,cauliflower florets, olive oil, fresh lemon juice, parsley, shallots, capers, kosher salt, fresh ground black pepper
Strawberry preserves,strawberries, sugar, lemon juice
Real Strawberry Ice Cream (No Ice Cream Maker Needed),frozen strawberries, cream, milk, icing sugar
Spaghetti with Simple Sauce,ground beef, crushed tomatoes, tomatoes, garlic, parsley, basil, oregano, parmesan cheese, spaghetti noodles, olive oil
Longing for Whipped Butter,butter, milk
Best Ever Strawberry Pie Recipe,flour, sugar, low - fat milk, salt, oil
Vegan Crepes,soymilk, water, margarine, turbinado sugar, maple syrup, unbleached all - purpose flour, salt
Peach Ginger Jam,peaches, lemon juice, sugar, ginger
Blackberry Sorbet,sugar, water, blackberries, limoncello
Caramel Topped Cranberry Streusel Squares,cranberries, granulated sugar, all - purpose flour, baking soda, oats, brown sugar, butter, dates, pecans, caramel topping, all - purpose flour
Savory Beef Roulades Recipe,breadcrumbs, pepper, butter, oats, water, dill pickles, onions, salt
Graham Crust,all - purpose flour, whole wheat flour, wheat germ, salt, ground cinnamon, unsalted butter, light - brown sugar
Healthy French Dressing,no - salt - added ketchup, sugar substitute, oil, onions, red wine vinegar, salt substitute, paprika, garlic powder
Gluten-Free Cherry Chocolate Granola,oats, shredded coconut, oil, honey, cashews, almonds, dried cherries, chocolate pieces
Asparagus With Gruyere,asparagus, salt, butter, gruyere cheese
Hawaij Recipe,black peppercorns, cumin seeds, coriander seeds, green cardamom pods, whole cloves, ground turmeric
K'sra -- Moroccan Bread (Morocco -- North Africa),active dry yeast, warm water, all - purpose flour, salt, anise seed, sesame seeds
Oat Bread for Bread Machine,water, butter, sugar, salt, oat bran, oats, bread flour, vital wheat gluten, yeast
Celery Salad,celery, sweet cherries, frozen green peas, fresh parsley, fat - free mayonnaise, plain low - fat yogurt, pecans, fresh lemon juice, salt, black pepper
Apricot Mayonnaise,light mayonnaise, apricot preserves, orange juice
Fresh Cherry Cup,dark sweet cherries, cantaloupe balls, green seedless grapes, ginger ale
Wild Blueberry Snack Smoothie,wild blueberries, cottage cheese, milk
Chickpea Snack,dried garbanzo beans, curry powder, salt, vegetable oil
Sweet And Sour Spareribs,pork spareribs, brown sugar, sugar, cornstarch, ketchup, vinegar, cold water
Soda Pop Marinade for Chicken,soy sauce, olive oil, soda pop, garlic powder, prepared horseradish
Fruit Jewels (Pate De Fruit),chunky applesauce, apricots, sugar, fresh raspberries
Cucumber-Horseradish Relish,cucumbers, fresh lemon juice, sugar, fresh dill, prepared horseradish, salt
Malted Milk Shakes,vanilla ice cream, sweetened condensed milk, ice, malt drink powder, molasses
Peach Sweet and Sour Sauce,peach jam, brown sugar, dry mustard, ground ginger, cider vinegar
Blackberry Biscuits,all - purpose flour, baking powder, salt, granulated sugar, unsalted butter, buttermilk, fresh blackberries
Dark Chocolate Almond Clusters,dark chocolate chips, salted almonds, kosher salt
Lemon-Pepper Potatoes,butter, chives, lemon pepper, water, red potatoes
Crunchy Granola (Muesli),rolled oats, wheat germ, coconut, sesame seeds, sunflower seeds, cinnamon, raisins, butter, honey, milk, salt
Quick and Easy Eggless Walnut and Date Cake,walnuts, dates, baking soda, sugar, all - purpose flour, hot water
Low-Cal Mustard Vinaigrette,Dijon mustard, apple juice, lemon juice, basil, oregano, pepper, salt, artificial sweetener
Honey Rye Bread,warm water, warm water, honey, butter, salt, rye flour, bread flour, ground flax seeds, active dry yeast
Sugar Plum,pomegranate juice, sugar, vodka, grapefruit juice, pomegranates
Quick Cottage Cheese,skim milk, white vinegar, kosher salt, heavy cream
Perfect Bread Machine Spelt Bread,spelt flour, spelt flour, fast - rising active dry yeast, water, salt, sugar, vegetable oil
Cottage Cheese Rolls,cottage cheese, margarine, flour, salt, icing sugar, milk, cinnamon
Peach Freeze,vanilla ice cream, unsweetened frozen peach slices, ground cinnamon, vanilla extract
BBQ Country-Style Ribs,water, barbecue sauce, powdered drink mix, oil, country - style pork ribs
Nutty Stir-Fry,chicken broth, oyster sauce, soy sauce, cornstarch, sesame oil, mushrooms, sweet red peppers, scallions, chicken, cooked rice
Basic Naan,bread flour, dried yeast, sugar, salt, water
Turkish Bread or Ekmek,bread flour, water, active dry yeast, white sugar, warm water, bread flour, salt
Viennese Almond Crescents,all - purpose flour, almond meal, kosher salt, butter, granulated sugar, powdered sugar
True Deep Chocolate Vegan Cake,unbleached white flour, unsweetened cocoa powder, baking soda, salt, sugar, vegetable oil, cold water, pure vanilla extract, cider vinegar, raspberry jam, dark chocolate chips, raspberry jam, water
Tex's Pizza Dough,plain flour, water, dry active yeast, sugar, salt, olive oil, black olives
A Scone for One,flour, baking powder, salt, sugar, butter, dried cranberries, walnuts, milk
Thai Chicken With Broccoli and Oyster Sauce,oyster sauce, fish sauce, sugar, fresh ground pepper, chicken stock, boneless skinless chicken breasts, vegetable oil, garlic, broccoli florets
Texas Brisket,paprika, fresh coarse ground black pepper, coarse salt, sugar, chili powder, beef brisket, beer, cider vinegar, water, canola oil, Worcestershire sauce, jalapenos, barbecue sauce, chili powder
Dipping Sauce for Coconut Shrimp,orange marmalade, stone ground mustard, prepared horseradish
Vanilla Sugared Almonds,unsalted butter, sugar, water, salt, ground cinnamon, ground nutmeg, vanilla extract, natural almonds, turbinado sugar
Cola Milkshake,vanilla ice cream, chocolate ice cream, cola, milk
Spa Cuisine - Rice Pudding,brown rice, water, skim milk, brown sugar, nutmeg, lemon juice, raisins, orange rind
Fruit Sherbet,lemon juice, sugar, orange juice, milk, pineapple juice
Water Chestnut Cake,boiling water, dark brown sugar, water chestnuts, cold water
Vegan Cupcakes,soymilk, apple cider vinegar, all - purpose flour, cornstarch, baking powder, baking soda, salt, canola oil, sugar, vanilla extract
Homemade Steak Rub,ground black pepper, sea salt, garlic granules, onions
Garlic-Cheese Monkey Bread,water, salt, sugar, olive oil, flour, parmesan cheese, onion powder, garlic powder, oregano, bread machine yeast, parmesan cheese, oregano, garlic powder, cheddar cheese
Original Bisquick Baking Mix Copycat,all - purpose flour, baking powder, powdered sugar, table salt, baking soda, canola oil
Oatmeal Orange-Nut Cookies,margarine, yogurt, brown sugar, vanilla extract, rolled oats, baking soda, walnuts, orange zest
Summer Beer,pink lemonade, light beer, vodka
