title,ingredient_list
Thyme-Roasted Carrots,carrots, olive oil, fresh thyme leaves, butter
Fudge Quickies,white sugar, brown sugar, butter, milk, semi - sweet chocolate chips, quick - cooking oats, walnuts, flaked coconut
Best Buttercream Frosting Recipe,vegetable shortening, butter, vanilla extract, powdered sugar, milk
Brown Rice Crispy Bar,brown rice, flax seed oil, orange blossom honey, mini marshmallows, slivered almonds, dried cranberries, dried cherries, dried blueberries
Marinade for Grilled Vegetables,olive oil, balsamic vinegar, onions, fresh basil, garlic, kosher salt, fresh ground black pepper
Brie Raclette,brie cheese, tiny new potatoes, broccoli, mushrooms, cooking oil, salt, cocktail onions
Honey Glazed Pecans,pecan halves, honey, cayenne pepper
Bacon Pecorino Popcorn,bacon, popcorn, pecorino cheese
Pineapple Pop 'em Balls,dried pineapple, shredded coconut, sesame seeds, pineapple juice
Potsticker Dipping Sauce,soy sauce, green onions, rice wine, sesame oil, brown sugar, fresh garlic
White Chocolate Macadamia Nut Bark,semi - sweet chocolate chips, white chocolate chips, macadamia nuts
Incredible Butter Substitute,corn oil, buttermilk, margarine
Red Wine Vinaigrette,red wine vinegar, Dijon mustard, salt, pepper, olive oil
Peanut Butter & Jelly Filled Spiders,reduced - fat peanut butter, strawberry jam, frozen bread dough
Apricot Dipping Sauce,apricot preserves, lemon juice, low sodium soy sauce, dry mustard, red pepper flakes, fresh ginger, garlic
Southern Fried Tofu,firm tofu, nutritional yeast flakes, salt, garlic granules, onion powder, dried parsley flakes, paprika, dried tarragon, dried dill weed, dried basil leaves, dried oregano leaves, curry powder, dry mustard, ground rosemary, ground celery seed, milk, fresh lemon juice, whole wheat flour, vegetable oil
Cinnamon Butter,butter, icing sugar, cinnamon
Almost No-Knead Bread 2.0,unbleached all - purpose flour, fast rise yeast, sea salt, water, beer, white vinegar, honey
Strawberry Preserves with Black Pepper and Balsamic Vinegar,strawberries, sugar, balsamic vinegar, water, cracked black pepper
Honey Graham Snack Mix,Fiber One Honey Clusters cereal, Golden Grahams cereal, honey roasted peanuts, golden raisins
Sesame Honey Dressing For Spinach Salads Recipe,dry mustard, sesame oil, seasoned rice vinegar, soy sauce, black pepper, honey, oil, Dijon mustard, salt
Mike's Special Seasoning,paprika, ground black pepper, salt, dark brown sugar, garlic powder, onion powder, ground cayenne pepper
Forbidden Rice,black rice, water, salt
Vegan Cinnamon Crumb Cake,flour, sugar, baking powder, salt, Earth Balance margarine, cinnamon, sugar, soy yogurt, almond milk, Earth Balance margarine
Margie's Shortbread Oatmeal Cookies,rolled oats, all - purpose flour, brown sugar, butter, baking soda, water
Brown Sugar Shortbread Cookies,butter, brown sugar, vanilla extract, all - purpose flour
Mustard and Brown Sugar-Rubbed Salmon,dark brown sugar, salt, fresh ground black pepper, ground cumin, ground mustard, salmon fillets, olive oil
Sport and Misty's Horse Cookies,oats, flour, carrots, salt, sugar, vegetable oil, water, molasses
Vegan Mexican Wedding Cookies,cake flour, pecans, coconut oil, "confectioners sugar", vanilla extract
Bacon & Brussel sprouts,Brussels sprouts, bacon
Caramel Butter Sauce,sugar, water, salt, cream of tartar, unsalted butter, whipping cream
Muesli,rolled oats, oat bran, raisins, dried apples, dried apricots, sunflower seeds, ground cinnamon
Ganzies Biscuits,all - purpose flour, baking powder, baking soda, salt, vegetable shortening, 3/4 cups Buttermilk, Or More As Needed
Sesame Seed Powder,sesame seeds, salt
Honey Teriyaki Chicken Wings,soy sauce, brown sugar, honey, vinegar, ginger, garlic pepper seasoning, chicken wings
Tofu Jerky I,garlic powder, salt, ground black pepper, firm tofu
Emeril's Mango Lassi,ice cubes, orange juice, mangoes, honey, plain yogurt, rose water
Orange and Mango Breakfast Smoothie,mangoes, orange juice, milk, wheat germ, sugar, ice
Homemade BBQ Sauce,ketchup, spicy mustard, apple cider vinegar, brown sugar, cinnamon
Blueberry Sweet Tart Recipe,vodka, Blueberry Schnapps, 1 ounce cherry mix, lemonade mix
Crisp Coconut and Chocolate Pie,unsalted butter, sweetened flaked coconut, bittersweet chocolate, heavy cream
Berry-Mango Smoothie,mangoes, frozen raspberries, Greek yogurt, milk, chia seeds, powdered drink mix
No Bake Snack Mix,bite size shredded whole wheat cereal, popped popcorn, pretzels, nuts, butter, Worcestershire sauce, seasoning salt, garlic powder
Chocolate Lollapoloozas,unsalted peanuts, granulated sugar, cream of tartar, water, unsweetened chocolate, semisweet chocolate
Grilled Chicken Wings With Tandoori Flavorings,vegetable oil, ground cumin, curry powder, garlic powder, salt, ground ginger, cayenne pepper, red wine vinegar, plain yogurt, chicken wings
Neck Bones 'N Rice,pork neck bones, salt, black pepper, instant rice
Winter Crunch Bark,white chocolate, pretzel sticks, dried cranberries, slivered almonds
Microwave Tablet,evaporated milk, unsalted butter, caster sugar
Salmon With Mixed Berry Reduction,salmon fillets, olive oil, salt, strawberries, blueberries, blackberries
Easy Apple Crisp with Honey,sliced apples, lemon juice, water, honey, ground cinnamon, brown sugar, all - purpose flour, rolled oats, butter
Thyme-Toasted Almonds,olive oil, fresh thyme, coarse sea salt, whole unblanched almonds
Dutch peanutsauce for french fries,mayonnaise, honey, lemon juice, hot paprika, cayenne pepper, peanut butter
Braised Brussel Sprouts With Vinegar And Dill Recipe,Brussels sprouts, fresh dill, salt and pepper
Citrus-Ginger Dressing (Volumetrics),lime juice, water, olive oil, sugar, fresh chives, fresh ginger, salt, black pepper
Shanghai Asparagus,fresh asparagus, vegetable oil, seasoning salt, ground ginger, white pepper, soy sauce
Sauerkraut,cabbage, pickling salt
Raspberry Vinegar,raspberries, white wine vinegar, sugar
Low Carb Flat Bread,soy flour, baking powder, salt, onions, warm water, olive oil
Easy Cheese and Onion Bread,all - purpose flour, baking powder, salt, milk, sugar, water, butter, shredded cheddar cheese, onions
Sweet and Sour Sauce,white sugar, white vinegar, water, soy sauce, ketchup, honey, cornstarch
Black Pepper Mustard,yellow mustard seeds, white wine vinegar, water, salt, fresh ground black pepper
Raspberry Sauce With a Twist,frozen raspberries, sugar, raspberry preserves, pink lemonade
Peanut Butter Chip Squares,butter, graham wafer crumbs, brown sugar, all - purpose flour, sweetened condensed milk, coconut, semi - sweet chocolate chips, peanut butter
Blue Cheese Spread,cream cheese, mayonnaise, Worcestershire sauce, walnuts, blue cheese, dried cranberries
Hester's Red Velvet Cake Icing,milk, flour, vegetable shortening, white sugar, vanilla extract
Pear Butter,pears, sugar, orange zest, ground nutmeg, orange juice
No-Fail Piecrust,whole wheat pastry flour, sea salt, unsalted butter, ice water
Butterscotch Sauce,unsalted butter, dark brown sugar, sugar, salt, water, light corn syrup, heavy cream, vanilla extract
Maple-Pecan Cream,butter, pecans, pure maple syrup, whipping cream
Spicy Chicken Mac Skillet,macaroni & cheese dinner mix, olive oil, boneless skinless chicken breasts, tomatoes and green chilies, diced tomatoes, cream of chicken soup, cheese
Chocolate Chip Ice Cream Pie,chocolate syrup, semi - sweet chocolate chips, crisp rice cereal, sour cream, chocolate chip ice cream
Skorpor,yeast, milk, butter, sugar, salt, cardamom, flour
Raisin Carrot Salad,crushed pineapple, cornstarch, dry mustard, cider vinegar, mayonnaise, carrots, raisins
Protein Mudslide - Protein Shake,skim milk, whey protein powder, sugar - free chocolate pudding mix, Splenda sugar substitute, syrup
Diabetic Champagne,white grape juice, diet lemon - lime soda, Splenda sugar substitute
Tomato Gravy,meat drippings, flour, salt, pepper, tomato juice, cold water
Vegetable Risotto,broccoli florets, zucchini, yellow squash, red bell peppers, chicken broth, extra virgin olive oil, onions, short - grain rice, dry white wine, parmesan cheese
Sweet & Tangy Barbecue Sauce,brown sugar, catsup, vinegar, mustard
Nigella Lawson Cocktail Sausages,sausage, sesame oil, honey, soy sauce
Almond Crescents,soft margarine, sugar, ground almonds, flour, salt, powdered sugar
Whiskey-Flavored Crab Soup,crabmeat, milk, butter, butter, flour, milk, heavy cream, whiskey
Kabocha No Nimono - Stewed Pumpkin/Squash (Japan),pumpkin, water, sugar, Japanese soy sauce
Maple-Cinnamon Frozen Yogurt,pure maple syrup, plain low - fat yogurt, vanilla extract, ground cinnamon
Pot Pie #1 Alaska Chicken Pot Pie,chicken, carrots, green peas, celery, butter, onions, flour, salt, black pepper, celery seeds, chicken broth, milk
Homemade Taco Seasoning Mix,chili powder, onion powder, ground cumin, garlic powder, paprika, powdered oregano, sugar, salt
Berry Syrup Recipe,unsweetened berries, frozen apple juice concentrate, cornstarch, water
Captain Cocoa Treats,butter, marshmallows, cocoa, "Capn Crunch cereal"
Basic Polenta Recipe,water, salt, cornmeal
Easy Tea Biscuits,flour, baking powder, salt, margarine, milk
Honey Cream Cheese Spread,cream cheese, honey, orange zest
Masters Acapulco Salad Dressing,white onions, fresh lime juice, Worcestershire sauce, light soy sauce, Tabasco sauce, Dijon mustard, rice wine vinegar, mayonnaise, olive oil, Equal sugar substitute
Apple Pie Filling for Canning,apples, sugar, cinnamon, nutmeg, cold water, apple juice, bottled lemon juice, starch
Spicy hot chocolate,whole milk, granulated sugar, cocoa powder, cayenne pepper, ground cinnamon
Oh Boy, Salad!,tomatoes, cucumbers, dill weed, light mayonnaise
Cheesy Sun Crisps,cheddar cheese, parmesan cheese, sunflower margarine, water, all - purpose flour, salt, quick oats, sunflower seeds
Broccoli Salad I,fresh broccoli florets, red onions, raisins, dry roasted sunflower seeds, plain yogurt, orange juice, fat - free mayonnaise
Always Right Rice,salt, long grain rice, butter
Im a Good Mommy Steel Cut Oatmeal,oatmeal, water, milk
The Fairway Cafe's Mitchell London Hot Chocolate,nonfat milk, semisweet chocolate, lowfat chocolate milk
Cane Sauce (For Dippin' Chicken),mayonnaise, ketchup, garlic salt, Worcestershire sauce, black pepper
Honey Oat and Wheat Rolls,water, butter, cider vinegar, powdered milk, honey, sugar, salt, bread flour, whole wheat flour, oatmeal, yeast
Blackberry Jam,blackberries, sugar, lemon juice
Spiced Pecans,pecan halves, unsalted butter, ground cinnamon, cayenne pepper, sugar, salt
Peach Cobbler,peaches, brown sugar, all - purpose flour, lemon juice, all - purpose flour, whole wheat flour, brown sugar, baking powder, butter, milk
Rouge Brussels Sprouts,canola oil, Brussels sprouts, bacon pieces, fresh thyme leaves, Dijon mustard, blue cheese
Dede's Buttermilk Bread,buttermilk, water, bread flour, salt, butter, honey, baking soda, yeast
Vanilla or Chocolate Buttercream,butter, cream cheese, powdered sugar, milk, vanilla extract
Cheddar Cheese Straws,cheddar cheese, butter, paprika, cayenne, salt, all - purpose flour
Apricot Preserve,fresh apricots, sugar
White French Dressing,mayonnaise, onions, Dijon mustard, white vinegar, white vinegar, sugar
Orangey Strawberry Drink,cold water, fresh strawberries, orange drink mix
Sauerkraut and Pineapple: a Side Dish for Ham,sauerkraut, butter, pineapple juice, crushed pineapple, parsley
Sharp Cheddar Cheese Ball,cream cheese, sharp cheddar cheese, French onion dip, Worcestershire sauce, lemon juice, parsley flakes, onion powder, garlic powder
Brown Butter Fruity Pebble Rice Krispy Treats,butter, miniature marshmallows, cereal, Fruity Pebbles cereal, white chocolate chips, vegetable oil
Crazy John's spicy mustard,Dijon mustard, flour, mustard powder, horseradish, white pepper, caster sugar, salt, water
Seared Salmon With Lime Butter,butter, salmon fillets, lime juice, kosher salt
Pizza Dough,yeast, salt, sugar, water, olive oil, flour
Skillet Candied Sweet Potatoes Recipe,sugar, water, butter, salt
No-Bake Chocolate Peanut Butter Oatmeal Balls,unsalted nuts, unsweetened coconut, creamy peanut butter, quick - cooking oats, chocolate chips, honey
Easy Chocolate Sauce Recipe,low - fat milk, chocolate flavored syrup
Honey-Sweetened Ketchup,tomato paste, honey, white vinegar, water, fresh lemon juice, salt, onion powder, garlic powder, ground cloves
Shanghai Ketchup Shrimp Dip,hoisin sauce, orange juice, garlic and red chile paste
Rehydrated Onions, Mcdonald's Style,dried onion flakes, water
Baklawa - Syrian Version of Baklava,phyllo dough, butter, walnuts, sugar, rose water, sugar, water, lemon juice, rose water
Tahitian Vanilla Frosting,"confectioners sugar", marshmallow cream, milk, unsalted butter, vanilla extract
Shrimp Fajitas In Lettuce Recipe,green onions, rice vinegar, soy sauce
Karens Cheese Ball,cream cheese, crushed pineapple in juice, green peppers, red onions, seasoning salt, pecans
Italian Feather Bread Pizza Dough,hot water, olive oil, fast rise yeast, white sugar, salt, all - purpose flour
Tropical Peanut Squares,corn syrup, brown sugar, peanut butter, Special K cereal, flaked coconut
Cream Cheese Frosting,unsalted butter, cream cheese, powdered sugar, vanilla extract
Golden Roast Turkey,turkey, butter, salt, black pepper
Cinnamon Stove Top Granola,olive oil, rolled oats, ground cinnamon, butter, honey, molasses, brown sugar, blanched slivered almonds, dried cherries
Barbecue Sauce,tomato sauce, paprika, brown sugar, dry mustard, vinegar, chili powder, Worcestershire sauce, green onions, salt, cayenne pepper
Frozen Berry-Melon Pops,cantaloupe, raspberries, sugar, lemon juice, light corn syrup
Raisin Orange Salad Dressing,mayonnaise, raisins, orange juice concentrate
Whole Grain Baking Mix,all - purpose flour, whole wheat flour, powdered milk, rolled oats, cornmeal, Crisco, salt, baking powder
Powdered Sugar Icing,powdered sugar, milk
Blueberry Pineapple Basil Smoothie,sweet basil, Baby Spinach, Greek yogurt, frozen blueberries, frozen pineapple chunks, coconut milk, vanilla protein powder, agave nectar, cinnamon
Almond And Cream Cheese Biscuits Recipe,caster sugar, butter, cream cheese, plain flour, vanilla essence, sliced almonds
Chocolate Almond Popcorn,white sugar, light corn syrup, butter, cocoa powder, salt, popped popcorn, salted almonds
Orange-Balsamic Dressing,orange juice, balsamic vinegar, orange peel, ground cumin, olive oil
Parmesan Potato Wedges,red potatoes, yellow onions, oregano, salt, black pepper, butter, parmesan cheese
Spiced Honey Pretzels,pretzel sticks, honey, butter, onion powder, chili powder
Nutty Granola II,canola oil, hot water, honey, rolled oats, sliced almonds, pecans, walnuts, raisins, golden raisins, dried cherries
Honey Vanilla Almond Granola,coconut oil, honey, vanilla extract, old fashioned oats, almonds
Chocolate Caramel Sauce,sugar, heavy cream, bittersweet chocolate, salt, vanilla extract
Dijon-Horseradish Dressing,sour cream, mayonnaise, Dijon mustard, horseradish, scallions, lemon juice
Cheese Straws,butter, shredded cheddar cheese, all - purpose flour, salt, ground red pepper
Chocolate Chunk Cookie Dough Frozen Yogurt,unsalted butter, dark brown sugar, granulated sugar, vanilla extract, all - purpose flour, baking soda, salt, mini chocolate chips, vanilla yogurt
Ma Grilli Risotta Recipe,pork, chicken broth, rice
Salted Bittersweet Fudge with Toasted Walnuts,unsalted butter, sweetened condensed milk, walnuts, vanilla extract, flaked sea salt, bittersweet chocolate chips, whipping cream
Orange Marshmallow Fruit Dip,cream cheese, marshmallow creme, orange rind, orange juice, ginger
Mustard Dill Bread - Bread Machine,water, Dijon mustard, butter, salt, bread flour, whole wheat flour, nonfat dry milk powder, brown sugar, dill weed, bread machine yeast
Best Buttermilk Biscuits,self - rising flour, vegetable shortening, buttermilk
Lassi (Yogurt Drink),plain yogurt, sugar, water, ground cardamom, rose water, ice
Orange Creamsicle Protein Balls,cashews, coconut, vanilla extract, orange extract, maple syrup, vanilla protein powder
Skillet Chicken With Black Walnuts,chicken pieces, vegetable oil, green beans, celery, salt, brown sugar, pepper, oyster sauce, hoisin sauce, chicken broth, cornstarch, soy sauce, sliced mushrooms, black walnuts
Spicy Hot Wings, Low Carb,chicken wings, butter, hot pepper sauce, garlic salt, paprika
Fruit & Honey Spinach Salad,spinach leaves, cantaloupe balls, fresh strawberries, fresh blackberries, seedless raspberry jam, raspberry vinegar, honey, olive oil, pecans
Potato Bread (Bread Machine),milk, water, vegetable oil, salt, bread flour, instant potato flakes, sugar, white pepper, active dry yeast
Smoking Brisket Rub,paprika, black pepper, salt, sugar, chili powder, garlic powder, onion powder, cayenne powder
Blueberry Topping for Ice Cream,unsalted butter, white sugar, blueberries
Garlic Mayonnaise Dip,garlic, olive oil, green onions, mayonnaise
Fiery Creole Pepper Rub,dried thyme, paprika, black pepper, garlic powder, ground red pepper, white pepper, salt
Rose-A-'Rita (cocktail),strawberry cream liqueur, strawberry margarita mix, 34 cup 7-Up soda (or Club Soda), tequila
Cinnamon Vanilla Ice Cream Sundae,French vanilla ice cream, ground cinnamon, rice, maple syrup
Hard Sauce,butter, "confectioners sugar", milk, molasses, almond flavoring
Brine For Oily Or Strong Tasting Fish Recipe,non - iodized salt, brown sugar, lemon juice, garlic powder, onion powder, water
AMIEs Chocolate RICE Pudding (Champorado),warm water, sweetened cocoa powder, sugar, sweet rice, evaporated milk
Miss Pixie's Honey Crackle,butter, sugar, honey, rice bubbles
Condensed Tomato Soup Recipe (Gluten-Free),tomato paste, water, sugar, chicken base, salt
Green Beans With Coconut,butter, mustard seeds, onions, fresh ginger, salt, fresh ground black pepper, green beans, crushed red pepper flakes, unsweetened coconut, fresh cilantro, lemon juice
Classic Cheese Log,cheddar cheese, swiss cheese, cream cheese, sour cream, horseradish mustard, onion powder, pecans
Golden Smashed Potatoes,yukon gold potatoes, olive oil, mustard seeds, skim milk, maple syrup, ground turmeric, salt, pepper
Southwestern Chicken,garlic powder, chili powder, salt, paprika, chicken breasts, lime juice
Raspberry Lemonade,frozen raspberries, water, fresh lemon juice, superfine sugar
Trail mix,almonds, cashews, walnuts, pecans, pumpkin seeds, dried pineapple, dark raisins, dark chocolate chips, coconut
Cranberry Wheat Bread,water, vegetable oil, dried cranberries, salt, whole wheat flour, bread flour, brown sugar, nonfat dry milk powder, bread machine yeast
Asparagus Topped With Crab Recipe,asparagus, green peppers, onions, butter, plain yogurt, Worcestershire sauce, tarragon, lemon juice, crabmeat, parmesan cheese
Super Skillet Fish,flour, salt, paprika, pepper, halibut, onions, butter, sour cream, basil, parsley
Biscuits,flour, baking powder, salt, sugar, butter, water
Whole Wheat Cookies Recipe,whole wheat flour, flour, salt, 1 teaspoon soda, rolled oats, brown sugar, cinnamon, ginger, cloves, raisins
Oven-Roasted Cheesy Cauliflower,cauliflower florets, 1/2 cup Kraft Extra Virgin Olive Oil Italian Pesto Parmesan Dressing, cheese
Adults Only Blood Bath Cocktail!,pomegranate juice, vodka, raspberry flavored syrup, lemon juice
Raspberries With Knepp,raspberries, sugar, water, cornstarch, flour, baking powder, sugar, salt, milk
Croq-Tele (Almond Cookies) Recipe,whole almonds, granulated sugar, fine salt, all - purpose flour, unsalted butter
Pecan Pie Brittle,sugar, pecans, unsalted butter, vanilla extract, baking soda, kosher salt
Plum Glazed Pork Tenderloin,plum jam, dry white wine, fresh rosemary, brown sugar, salt, pork tenderloin
Beet and Horseradish Relish,cooked beets, horseradish, sugar
Parsley Butter,fresh parsley, lemon juice, Worcestershire sauce, sweet unsalted butter
Lisa's Low Fat Shrimp Diane,shrimp, green onions, sliced mushrooms, reduced - calorie margarine, 12 cup shrimp stock (or 1 tsp shrimp boullion dissolved in 1/2 cup water)), black pepper, cayenne pepper, thyme, onion powder, oregano, salt, garlic powder, long grain brown rice, shrimp bouillon
Aunt Kay's Peanut Butter Fudge,granulated sugar, brown sugar, milk, creamy peanut butter, vanilla extract
Creamy Carrot Casserole,carrots, mayonnaise, onions, prepared horseradish, shredded cheddar cheese, dry breadcrumbs, margarine
Olive Stuffed Cheese Biscuits,sharp cheddar cheese, butter, flour, salt, paprika, red peppers, green olives
Classic Pizza Sauce,tomatoes, sugar, salt, garlic powder, dried oregano, black pepper, olive oil
Cherry Tomatoes (Stuffed) Recipe,cottage cheese, chives, dill weed
Grape Crush,red seedless grapes, grape juice, lemons, vodka
Brandied Cherries (For Chocolate Cherry Trifle) Recipe TrishUntrapped,4 cups frozen, dark, sweet cherries, thawed and drained. (Reserve 1/4 cup of the cherry juice for the cherry pudding used in the trifle.), granulated sugar, brandy
French Bread Dough,water, sugar, salt, bread flour, active dry yeast, water, salt
Fresh Raspberry Sorbet,fresh raspberries, sugar, fresh lime juice
Blood Orange Granita,blood orange juice, lemon juice, sugar, black pepper
Spinach With Olive Oil and Lemon!,Baby Spinach, olive oil, lemon juice, salt, walnuts
Sue's Hash Brown Casserole,frozen hash browns, sour cream, cream of mushroom soup, Ritz crackers, cheddar cheese, French onion dip, butter
Peanut Butter Granola,rolled oats, whole wheat flour, walnuts, yeast, salt, powdered milk, shredded coconut, white sugar, water, canola oil, peanut butter
Roasted Snap Peas and Soba Noodles,snap peas, olive oil, salt, soba noodles, soy sauce, rice vinegar, sesame oil, honey, sesame seeds
Blueberry-Pineapple Protein Shake,low - fat milk, frozen blueberries, pineapple
Flaky Buttermilk Biscuits,all - purpose flour, baking powder, baking soda, salt, unsalted butter, buttermilk
Garlicky Buttered Shrimp,garlic, butter, shrimp, basil, cilantro, crushed red pepper flakes, milk, flour, parmesan cheese
Oatmeal Cinnamon Scones Vegan,margarine, whole wheat pastry flour, brown sugar, baking powder, baking soda, salt, cinnamon, old fashioned oats, raisins, vanilla - flavored soymilk
Carrot Salad With Pineapple (No Mayo),carrots, raisins, crushed pineapple
Pickled Eggs Or Gizzards Recipe,salt, sugar, salt
Chef John's Christmas Miracle Fudge,unsweetened cocoa, real maple syrup, vanilla extract, salt, coconut oil, walnuts, unsweetened cocoa powder
Easy Salsa Chicken,chicken, salsa, olive oil, taco seasoning, light cream cheese
Ginger Dressing,onions, peanut oil, rice vinegar, water, fresh ginger, celery, ketchup, soy sauce, sugar, lemon juice, garlic, salt, black pepper
Cranberry Vinaigrette,fresh cranberries, apple cider, pure maple syrup, olive oil, Dijon mustard, cider vinegar, salt, cracked black pepper
Trail Mix,roasted soybeans, raisins
Sauced Fish,butter, mayonnaise, sour cream, fresh lemon juice, cod fish fillets
Chocolate Cashew Spread,semi - sweet chocolate chips, unsalted cashews, butter
Easy White Sauce in the Microwave,milk, white flour, vegetable oil, salt and pepper, skim milk powder, water
Chocolate Macadamia Nut Bars,all - purpose flour, dark brown sugar, butter, macadamia nuts, butter, dark brown sugar, semisweet chocolate morsels
Broccoli With Feta Recipe,broccoli, olive oil flavored cooking spray, reduced - fat feta cheese
Bootlegger's Beef,beef tenderloin, vegetable oil, onions, carrots, dried thyme, beef broth, whiskey, all - purpose flour, butter, whipping cream, black peppercorns
Brown Sugar, Raisin, And Date Cream Cheese Recipe,cream cheese, raisins, dates, brown sugar
Teddy Bear Juice,apple juice, hot water, lemon juice, honey
Cinnamon Chicken Salad,low - fat mayonnaise, low - fat yogurt, vanilla essence, ginger, ground cinnamon, chicken breasts, blueberries, green seedless grapes, celery, fresh pineapple, red bell peppers
Grandma Clark's Cranberry Jelly,fresh cranberries, water, sugar
Terrific Toppings,plums, sugar, peaches, ginger ale, Granny Smith apples, raisins, cinnamon, sugar, pecans
Pineapple Coleslaw,cabbage, pineapple chunks, celery, sweet red peppers, heavy cream, vinegar, salt, pepper
Goldilock's Porridge,pearl barley, oatmeal, milk, heavy whipping cream, butter, brown sugar, real maple syrup, golden raisins, pecans, salt, cinnamon
Warm Brownie Pudding Cake,flour, granulated sugar, baking powder, baking soda, salt, cocoa powder, unsweetened cocoa, milk, butter, vanilla extract, brown sugar, boiling water
Creamy Caramel Sauce,sugar, water, heavy cream, vanilla extract
Linda's Herb-Crusted Roast Pork Tenderloin,pork tenderloin, butter, olive oil, fresh parsley, fresh thyme, fresh garlic, fresh rosemary
Tennessee Whiskey Sweet Potato Casserole,water, sweet potatoes, brown sugar, whiskey, butter, ground cinnamon, ground nutmeg, salt, butter, brown sugar, pecans
Boston Baked Beans (Dry K Recipe,water, water, bacon, beans, sugar, cider vinegar, salt
Refreshing Chocolate Grapefruit Granita,grapefruit juice, sugar, honey, unsweetened cocoa, dark chocolate, soymilk
Coconut Bark,coconut, sweetened condensed milk
Graham and Fruit Bars,all - purpose flour, Golden Grahams cereal, brown sugar, ground cinnamon, butter, apricot jam
Pork Hamonado,pork butt, pineapple juice, pineapple chunks, soy sauce, brown sugar, cooking oil
Mustard Oil Dressing,dijon - style mustard, vegetable oil, red wine vinegar, ground black pepper, salt, garlic salt, onion powder, olive oil
Lime Ginger Honeydew,Splenda granular, water, lime zest, lime juice, fresh ginger, honeydew melon
Chocolate Biscuits (Cookies),rolled oats, desiccated coconut, self - raising flour, wholemeal self - rising flour, cocoa powder, sugar, bicarbonate of soda, margarine, water, currants, peanuts
Instant Mexican Style Hot Cocoa,powdered sugar, unsweetened baking cocoa, powdered milk, salt, cornstarch, cinnamon, nutmeg, cayenne pepper
Cheddar Breadsticks,water, extra virgin olive oil, salt, granulated sugar, bread flour, sharp cheddar cheese, paprika, yeast
