title,ingredient_list
Yogurt Parfaits,non - fat vanilla yogurt, strawberries, low - fat granola
Salt Free, Low Cholesterol Sugar Cookies Recipe,granulated sugar, corn oil, Egg Beaters egg substitute, orange rind, orange juice, baking powder, flour
Honey Sriracha Chicken Wings,chicken wings, salt, pepper, oil, butter, hot sauce, honey, rice wine, soy sauce, hoisin sauce, salt, cilantro
Shrimp and Caper Salad,shrimp, green onions, celery, capers, black olives, oil - and - vinegar dressing, mayonnaise, celery seeds, lemon juice
Natural Peanut Butter Chocolate Bon Bons,cocoa powder, honey, natural - style peanut butter
Easy Cheese Sauce,process American cheese, milk, onion salt, red pepper sauce
Easy Chocolate Frosting Recipe,unsweetened chocolate, cream cheese, low - fat milk, "confectioners sugar", salt
Cornmeal Crackers with Pumpkin Seeds,stone - ground yellow cornmeal, all - purpose flour, pumpkin seeds, kosher salt, sugar, crushed red pepper flakes, unsalted butter, milk
Chocolate-Orange Angel Food Cake,powdered sugar, cake flour, cocoa powder, egg whites, granulated sugar, salt, Orange sherbet
Rice With Lemon, Capers & Parsley,white rice, water, unsalted butter, salt, black pepper, lemon juice, capers, parsley
Cheryl's Veggie-Nut Patties,2/3 cup 1/2-inch butternut squash cubes, cauliflower, broccoli, walnuts, almonds, sunflower seeds, salt, ground cumin, ground black pepper, vegetable oil
Creamed Broccoli And Cauliflower Soup Recipe,broccoli, cauliflower, water, salt, basil, butter, flour, low - fat milk
Fudgy Chocolate Cherry Float,vanilla ice cream, Magic Shell ice cream topping, black cherry soda
Aunt Julie's Pineapple Cookies,cream cheese, butter, sifted flour, pineapple preserves, powdered sugar
Broccoli Chicken Casserole Recipe,broccoli, cooked rice, chicken, lemon juice, mayonnaise, cheddar cheese, cream of chicken soup
Chicken Diable,butter, honey, prepared mustard, salt, curry powder, chicken
Pacific Wasabi Sauce for Grilled Tuna,mayonnaise, sour cream, Dijon mustard, lime juice, wasabi paste, kosher salt, fresh ground black pepper
Cornmeal Mush,water, salt, yellow cornmeal
Sugar Free Pudge-less Brownies,unsweetened cocoa powder, all - purpose flour, cornstarch, baking soda, salt, Splenda sugar substitute, non - fat vanilla yogurt
Mango Lassi,yoghurt, cold water, light syrup, sugar, saffron
Peanut Butter Fudge Frosting,unsalted butter, peanut butter, salt, powdered sugar, unsweetened cocoa powder
Potato and Hamburger Baskets #SP5,Simply Potatoes Shredded Hash Browns, ground beef, sharp cheddar cheese, salt, pepper
Lemon Butter for Steak,lemon juice, butter, salt, paprika, fresh parsley
Barbeque Brisket Rub,chili powder, dry mustard, garlic powder, cayenne pepper, seasoning salt, paprika, black pepper
Cilantro-Mustard Mayo (Dip or Sauce),Dijon mustard, mayonnaise, cilantro, chili powder, ground cumin
Tomato-Olive Bread,whole wheat pastry flour, wheat germ, baking powder, salt, granulated sugar, ground cumin, dried basil, dried thyme, 1 cup rice milk, or more as needed, olive oil, tomatoes, olives
Creamy Country Dijon Sauce,Dijon mustard, sour cream
Chocolate Almond Sauce,semisweet chocolate morsels, whipping cream, butter, salt, almonds, almond flavored liqueur
Pitas,unbleached all - purpose flour, salt, sugar, yeast, water, extra virgin olive oil
Bacon and Cheese Party Bread,bacon, shredded cheddar cheese, prepared mustard, mayonnaise, bread
Swedish Butter Cookies,butter, sugar, maple syrup, all - purpose flour, baking soda, "confectioners sugar"
Cherry Tomato Corn Salad,fresh basil, olive oil, lime juice, sugar, salt, pepper, frozen corn, cherry tomatoes, cucumbers
Two-Tone Chocolate Pudding Cups,chocolate instant pudding, milk, chocolate instant pudding, raspberries, powdered sugar
Irish Soda Bread,flour, whole wheat flour, baking soda, salt, butter, buttermilk, flour
Nutritious Ice Cream Sandwich,spelt flour, date sugar, cinnamon, oats, baking soda, hot water, coconut oil, vanilla extract, chocolate chips, walnuts, ice cream
Cheddar Cheese Coins,aged cheddar cheese, unsalted butter, all - purpose flour, dry mustard, Worcestershire sauce, Tabasco sauce
Magic Bullet Chicken and Rice Baby Food,cooked chicken, cooked rice, water
Gingerbread Flavored Whipped Cream,gingerbread - flavored syrup, heavy whipping cream
Frozen Banana Smoothie,half - and - half, bananas, banana liqueur, "Hersheys syrup", ice cubes
Creamy Curry Salad Dressing,nonfat plain yogurt, low - fat mayonnaise, lemon juice, water, honey, curry powder, salt, pepper
Peanut Brittle,sugar, light corn syrup, water, water, dry roasted salted peanuts, unsalted butter, pure vanilla extract, baking soda
Pineapple Ginger Smoothie,frozen pineapple chunks, ginger, Greek yogurt, flax seeds, orange juice, 3/4 cups Regular, Unsweetened Almond Milk
Corn Cake Casserole,all - purpose flour, cornmeal, sugar, baking powder, salt, cream - style corn, canned corn, unsalted butter, canola oil
White Chocolate Bark,pistachios, white chocolate, dried cranberries, dried apricots
Salted Caramel Bark,corn syrup, sugar, dry roasted salted peanuts, semisweet chocolate, salt
Four Hour Baguettes,water, instant yeast, unbleached all - purpose flour, sea salt
Oatmeal Lace Cookies,salted butter, oats, sugar, flour, baking powder, heavy cream, corn syrup, salt
Hearty Cheese (And Turkey) Soup,lean ground turkey, onions, potatoes, reduced - sodium chicken broth, celery, salt, dried basil, dried parsley flakes, pepper, all - purpose flour, skim milk, processed cheese, reduced - fat sour cream
Horseradish Butter (Pepperrotsmor),butter, horseradish sauce, salt
Lemon Charge,strawberries, sugar, nonfat milk, lemon low fat yogurt
Baked Brown Rice,brown rice, water, butter, salt
Anzac Biscuits I,quick - cooking oats, flaked coconut, all - purpose flour, baking soda, white sugar, butter, golden syrup, boiling water
ABC Snack Mix,cereal, popped popcorn, dried apricots, pecan halves, honey, non - hydrogenated margarine
Lemon Sauce,mayonnaise, fresh lemon juice, fresh dill, sour cream, salt, pepper, garlic
Chocolate Krispy Bars Recipe,marshmallows, butter, pebbles
Caramel-Fudge Sauce,sugar, dark corn syrup, water, heavy cream, unsalted butter, bittersweet chocolate, pure vanilla extract, salt
Pita Bread,all - purpose flour, salt, sugar, 2 tsp Yeast or 1 packet, warm water, oil
Low Fat Peanut Butter Chocolate Crunch Bars,chocolate - flavor crisp rice cereal, reduced fat margarine, reduced - fat peanut butter, large marshmallows, semisweet chocolate morsels, Fiber One cereal
Dijon Potato Leek Soup,leek, garlic, dried thyme leaves, oil, vegetable stock, 1 gal. Large russet potatoes, peeled, sliced Safeway 2 pkg For $5.00 thru 02/09, whipping cream, Dijon mustard
Crock Pot Caramelized Onions,onions, margarine, salt
Cheesy POPcorn,vegetable oil, corn kernels, butter, parmesan cheese
Amaretto Cranberry Juice Recipe,cranberry juice
White Chocolate Cherry Toffee Popcorn,vegetable oil, popcorn, candied red cherries, pretzels, white chocolate chips, unsalted butter, light brown sugar, light corn syrup, vanilla extract, kosher salt
Mango Cheese,sugar, fresh lime juice, mango pulp
Chicken Noodle Salad,rice noodles, coleslaw mix, chicken, carrots, fresh cilantro, 1/2 cup Kraft Italian Zesty Lime Dressing
Focaccia Buns,warm water, active dry yeast, olive oil, salt, basil, thyme, rosemary, all - purpose flour
Chocolate Covered Coconut Martini,lowfat chocolate milk, vodka, coconut rum
Broccoli Cheese Soup,butter, onions, celery, carrots, flour, cornstarch, chicken stock, milk, American cheese, dried parsley flakes, red cayenne pepper, frozen broccoli
Easy Pizza Dough for Bread Machine,water, extra virgin olive oil, salt, bread flour, sugar, bread machine quick - acting active dry yeast, dried herbs, semolina
The Best Teriyaki Recipe Ever!,water, brown sugar, soy sauce, garlic powder, cinnamon
Spicy Pepitas,pepitas, fresh ground black pepper, cayenne pepper, ground cumin, chili powder, salt
Low Carb Seafood Cocktail Sauce,low - carb ketchup, horseradish, celery seeds, Worcestershire sauce, Tabasco sauce, lemon juice
Strawberry-Infused Vodka,strawberries, vodka
Homemade Ice Magic,milk chocolate melts, unsalted butter, vegetable oil
Baked Cheesecake,cream cheese, fine sugar, eggs, fresh lemon juice, homogenized milk, graham crackers, vanilla extract
Basic Brine for Smoking Meat,kosher salt, brown sugar, water
My Easy Chicken Ala King,butter, boneless skinless chicken breasts, mushrooms, all - purpose flour, salt, pepper, chicken broth, heavy cream, frozen peas, chopped pimiento
Oatmeal Fiber One Berry Breakfast Bars,flour, brown sugar, butter, quick - cooking rolled oats, orange juice, Fiber One cereal, brown sugar, flour, salt, blackberries, lemon juice
Coconut Almond Goji Berry Granola,rolled oats, coconut oil, salt, maple syrup, shredded coconut, almonds, goji berries, golden raisins
Jam Bars,flour, baking powder, salt, quick oats, sugar, margarine, jam
Pecan Pralines,heavy whipping cream, brown sugar, vanilla extract, pecan halves, butter
Rib Dry Rub,cumin, paprika, granulated garlic, granulated onion, chili powder, brown sugar, kosher salt, cayenne pepper, black pepper, white pepper
Chinese Pot Roast Recipe,beef, lard, pepper, soy sauce, water, cabbage
Orange Grove,rye whiskey, fresh orange juice, ginger liqueur
Caramel Date Bars With Cranberries And Walnuts Recipe,cranberries, sugar, flour, rolled oats, light brown sugar, baking soda, butter, dates, walnuts, caramel ice cream topping
Buttermilk Chocolate Biscuits,all - purpose flour, baking soda, baking powder, salt, butter, buttermilk, sugar, cocoa powder, whole milk, butter
Roasted Mushrooms Stuffed with Feta, Spinach, and Bacon,bacon, onions, frozen chopped spinach, feta cheese, cream cheese, dry crushed red pepper, button mushrooms
Dahi Barfi (Sweet Yogurt Bars),yogurt, sweetened condensed milk, raisins, cashew nuts, baking powder, flour
Baked Marinated Salmon,salmon fillets, brown sugar, garlic powder, soy sauce, lemon juice
Real Crazy Cake,all - purpose flour, cocoa, baking soda, sugar, salt, vinegar, vanilla, vegetable oil, water
Chocolate Chip Ice Cream,whipping cream, milk, sugar, vanilla extract, chocolate chips
Honey Mustard,mayonnaise, Dijon mustard, mustard, honey, lemon juice
Yin-Yang Soup,corn, water, salt, spinach, cornstarch, vegetable oil
Low Fat Spicy Crab Dip,low - fat cream cheese, Worcestershire sauce, fat - free mayonnaise, lemon juice, salsa, crabmeat
Walnut Shortbread Cookies,flour, baking powder, butter, powdered sugar, walnuts
Godiva Chocolate Berry Diva,Godiva milk chocolate liqueur, raspberry liqueur, club soda
Coffee Cake,flour, sugar, cinnamon, ground cloves, ground nutmeg, butter, buttermilk, baking soda, raisins, nuts
Microwave Glazed Walnuts,walnut halves, white sugar, water
Red Wine Vinaigrette,red wine vinegar, fresh lemon juice, honey, olive oil, salt, fresh ground black pepper
Five-Spice Tofu Stir-Fry with Carrots and Celery,peanut oil, tofu cakes, carrots, celery, 1/3 cup finely chopped rinsed canned Szechuan preserved vegetable (about 1 1/4 ounces), shaoxing wine, salt, sugar, white pepper, sesame oil
Homemade ricotta cheese,whole milk, heavy cream, salt, white wine vinegar
Fiesta Chicken Casserole,pie crusts, salsa, soup, sour cream, cheddar cheese, whole kernel corn, chicken breasts, black beans
Beef Fondue Recipe,filet mignon
Greatest Granola,rolled oats, sesame seeds, sunflower seeds, honey, sunflower oil, water, raisins, shredded coconut
Creamy French Dressing,red wine vinegar, tomato paste, Dijon mustard, sugar, garlic, salt, pepper, olive oil
Decadent Vegan Dark- Choco Brownies,all - purpose flour, unbleached cane sugar, unsweetened cocoa powder, baking powder, salt, vegan margarine, ground flax seeds, water, vanilla extract, unsweetened dark chocolate, pecans
Mediterranean Spice Mix,dried rosemary, ground cumin, ground coriander, dried oregano, ground cinnamon, salt
Simmered Chestnuts (for Beginners),chestnuts, sugar, salt, baking soda
Luscious Luau,water, white bread flour, dry milk, salt, butter, brown sugar, carrots, flaked coconut, crushed pineapple, macadamia nuts, cinnamon, fast rise yeast
Quatre Epices (Four Spices) Gascon,cloves, nutmeg, black pepper, cinnamon
Red Robin Chillin' Mango Smoothie,canned mango, grenadine, orange juice, ice
West African Chicken-Peanut Soup,cooked chicken, diced onions, garlic, sesame oil, curry powder, salt, black pepper, dried red pepper flakes, chicken broth, tomato paste, stewed tomatoes, chunky peanut butter, cooked rice
Cheese Cookie Snacks,shredded cheddar cheese, butter, all - purpose flour, salt, crisp rice cereal
Fresh Corn Tortillas,tortillas, warm water
Cream of Fresh Cauliflower Soup,chicken broth, onions, cauliflower, curry powder, butter, flour, milk, salt, pepper
Vanilla Butter Frosting,butter, powdered sugar, milk, vanilla extract
Roasted Sweet Potatoes With Cinnamon Pecan Crunch,brown sugar, orange juice, pure vanilla extract, cinnamon, ginger, salt, sweet potatoes, dried cranberries, butter, flour, pecans
Special Spuds,potatoes, onions, dried parsley, garlic powder, seasoning salt, fresh ground black pepper, olive oil
Gooey Peanut Butter Chew,crunchy peanut butter, brown sugar, honey, Rice Krispies
Cinnamon Raisin Biscuits,all - purpose flour, sugar, baking powder, baking soda, ground cinnamon, table salt, vegetable shortening, raisins, buttermilk, powdered sugar, milk, vegetable oil, cinnamon
Pumpkin Spice Ganache,chocolate, pumpkin pie spice, heavy whipping cream
Semolina Pudding (Parsi Ravo),clarified butter, raisins, nuts, 2% low - fat milk, semolina, 1/2 cups Sweetened, Condensed Milk, cardamom powder, nutmeg, vanilla essence, rose water
Honey Oatmeal Bread (Abm),warm water, butter, honey, bread flour, oatmeal, powdered milk, salt, active dry yeast
Banana Smoothie,bananas, fresh curds, orange juice
Jorgydee's Burgers,lean ground beef, pork sausage, garlic powder, seasoning salt
Bacon Crunch Bars,sugar, corn syrup, peanut butter, Grape - nuts cereal, bacon
Dark Raspberry Truffles,walnuts, raisins, raisins, cocoa powder, raspberries, vanilla extract, cocoa powder
Sweet-and-Sour Dressing,vegetable oil, vinegar, sugar, salt, celery seeds, dry mustard, paprika, onions
Date Squares,pitted dates, orange juice, cinnamon, all - purpose flour, salt, brown sugar, butter, sweetened flaked coconut, pecans, old fashioned oats
Easy Bake Oven Angel Cookies,butter, sugar, brown sugar, salt, flour, cream of tartar, baking soda
Fruity Rice Krispie Treats / Squares - Kids No Bake,white chocolate, margarine, golden syrup, Rice Krispies, rolled oats, dried apricots, walnuts
Ethiopian Spicy Cheese Dip,farmer cheese, clarified butter, cayenne pepper, garlic powder, cardamom powder, white pepper
Homemade Brown Sugar,sugar, molasses
Crock Pot Candy,unsalted dry roasted peanuts, dry roasted salted peanuts, semi - sweet chocolate chips, white chocolate chips, vanilla bark
Potato English Muffins,flour, baking powder, salt, sugar, nutmeg, butter, mashed potatoes, milk
Lite Cinnamon Apple Snack,apples, cinnamon, apple pie spice, golden raisins, walnuts
Chocolate Brittle,butter, sugar, almonds, walnuts, chocolate, walnuts
Sugar & Spice Nuts,powdered sugar, ground cinnamon, ground nutmeg, butter, mixed nuts
Vineyard Fizz (non-alcoholic),grape juice, lemon juice, fine sugar, cream soda
Vegan Shortbread,vegan margarine, brown sugar, plain flour
Tequila Sunrise,tequila, orange juice, grenadine
Cheesy Potato Loaf (Bread Machine),water, nonfat dry milk powder, salt, sugar, bread flour, instant potato flakes, sharp cheddar cheese, dry mustard, bread machine yeast
Sunflower Seed Mix. Back to School,sunflower seeds, pine nuts, pumpkin seeds, raisins, dried sweetened cranberries
Summer Strawberry Shortcake,strawberries, sugar, all - purpose flour, baking powder, sugar, salt, unsalted butter, heavy cream, heavy cream
No-Knead Swedish Cardamom Braid,almond milk, flax seed meal, agave nectar, canola oil, active dry yeast, salt, cardamom seeds, unbleached white flour, demerara sugar
Garlic Squares,fresh garlic, onions, butter, butter, flour, baking powder, salt, parsley, dill, milk, sharp cheddar cheese
Pear 'N Cranberry Pie,pie shells, pears, fresh cranberries, sugar, cornstarch, water, margarine, powdered sugar, water
Sausage and Rice Bake,long grain rice, sausage, celery, onions, green peppers, seasoning salt, seasoned pepper, chicken broth, pecan halves
Cajun Butter Sauce,chili powder, black pepper, garlic powder, red peppers, butter, cornstarch, chicken broth
Creamy Vegan Hot Cocoa,coconut milk, vanilla extract, white sugar, cocoa powder, ground cinnamon, boiling water
Roasted Shrimp and Vegetables,1 lb. large shrimp (21 to 30 count), peeled, deveined Safeway 1 lb For $8.99 thru 02/09, vegetables, KRAFT Zesty Italian Dressing, cilantro, lime zest, chili powder
Almond Bark Rice Krispies Recipe,candies, salted peanuts, crunchy peanut butter, Rice Krispies
Vegetarian "chicken" Fried Steak,vegetarian chicken substitute, flour, cornmeal, paprika, salt, black pepper, plain soymilk, flour, vegetable oil, vegetable stock, fresh parsley, soy cream
Chipped Beef Bake,celery, onions, vegetable oil, flour, milk, pepper, salt, mild cheese, chipped beef, ripe olives, soft breadcrumbs, butter
Blackberry Kamikaze Recipe,vodka, sour mix
Crunchy Granola,brown sugar, water, pure vanilla extract, salt, rolled oats, walnuts
Apricot Strudel,butter, cream cheese, flour, apricot preserves, shredded coconut, nuts
Apricot Mustard,mustard, apricot preserves, dry mustard
Scrumptious Chocolate Peanut Butter Cottage Cheese,nonfat cottage cheese, vanilla extract, peanut butter, Splenda sugar substitute, cocoa powder
Buttered Potatoes,new potatoes, butter
Best Ever Hot Cocoa Mix,nonfat dry milk powder, "confectioners sugar", Dutch - processed cocoa powder, white chocolate chips, salt
Del Rancho Garlic Dressing,mayonnaise, lemon juice, garlic powder
Peanut Butter Pots de Creme,milk, heavy cream, creamy peanut butter, bittersweet chocolate, egg yolks, granulated sugar, honey, salt, vanilla extract, bittersweet chocolate, heavy cream
Chicken Shepherd's Pie,potatoes, cooked chicken, cream of chicken soup, frozen mixed vegetables
Deli Coleslaw,mayonnaise, cider vinegar, sugar, salt, ground black pepper, green cabbage, carrots
Roasted Beet Relish with Apricots,beets, dried apricots, pomegranate molasses, red onions, olive oil
Eggless Crepe for Egg Allergies,skim milk, all - purpose flour, water, butter, white sugar, salt, vegetable oil
Italian Herb Rolls,water, salt, vegetable oil, bread flour, dried parsley, sugar, dried onion flakes, basil, garlic powder, yeast
Freezer Sweet Corn,sweet corn, water, salt, sugar
Hot Chicken Salad,cooked chicken, water chestnuts, celery, sliced almonds, pimientos, onions, mayonnaise, lemon juice, salt, pepper, cheddar cheese, French fried onion rings
"Bread Machine Cookbook" Semolina Bread Recipe,water, extra virgin olive oil, sugar, salt, semolina flour, bread flour, yeast, water, extra virgin olive oil, sugar, salt, semolina flour, bread flour, yeast
Baked Potato Dip,sour cream, mayonnaise, sharp cheddar cheese, bacon bits
Perfectly Chocolate Hershey's Hot Cocoa,sugar, cocoa, salt, milk, vanilla extract
Egg Nog Truffles,white chocolate, powdered sugar, rum extract, cream cheese, nutmeg
Ice Cream and Candy Shakes,vanilla ice cream, candy bars, milk
Strawberry Jam,strawberries, lemon juice, sugar
Bon Appetit Cranberry Margaritas,tequila, frozen cranberry juice concentrate, jellied cranberry sauce, fresh lime juice, orange liqueur
Advent Cookies,black treacle, brown sugar, cocoa powder, butter, cinnamon, vanilla extract, flour
Classic Caramel Milkshake,soymilk, caramel ice cream topping, vanilla
Mozzarella Marinated With Basil and Sundried Tomatoes,mozzarella cheese, fresh basil leaves, sun - dried tomatoes, olive oil
TSR Version of Burger King Zesty Onion Ring Sauce by Todd Wilbur,mayonnaise, granulated sugar, ketchup, lemon juice, prepared horseradish, ground cayenne pepper
Boiled Peanuts,salt, water, raw peanuts
Asian Green Bean Salad Recipe,1 lb Long green beans trimmed, cooked, and cooled, crushed red pepper flakes, rice vinegar, garlic, extra virgin olive oil, sesame oil, cherry tomatoes, peanuts
Basil Cheese Torte,fresh basil, fresh parsley, parmesan cheese, olive oil, pine nuts, cream cheese, butter, lemon juice, salt, Tabasco sauce, pine nuts
Vienna Sugar Cookies,dry yeast, water, butter, flour, sugar
Chocolate Peanut Clusters,milk chocolate chips, semi - sweet chocolate chips, shortening, unsalted dry roasted peanuts
Godiva Truffletini,Godiva white chocolate liqueur, Godiva original chocolate liqueur, ciroc grape vodka
Low Carb Cessesburger Soup,lean ground beef, bacon, celery, celery, carrots, onions, basil, chicken broth, broccoli, 2 cup cauliflowe, shredded cheddar cheese, heavy cream, ground pepper, salt, sour cream
Cheese Buttons,sharp cheddar cheese, all - purpose flour, margarine, salt, ground red pepper
Black and Blue,blackberry schnapps, Blueberry Schnapps, orange juice, cranberry juice
Passover Apples and Honey (Charoset),honey, ground cinnamon, apples, grape juice, walnuts
Bone Dust BBQ Rub,paprika, chili powder, salt, ground coriander, garlic powder, white sugar, curry powder, dry hot mustard, fresh ground black pepper, ground basil, ground thyme, ground cumin, cayenne
Godiva Cranberry Martini,Godiva original chocolate liqueur, vodka, cranberry juice
Cinnamon Oatmeal Milk Bath,cornstarch, powdered milk, oatmeal, cinnamon
Shrimp Cocktail,shrimp
Mexican Hot Chocolate - 4 Ww Points,nonfat milk, dark brown sugar, unsweetened cocoa powder, semisweet chocolate, cinnamon
Simple Potato Bread,instant potato flakes, water, bread, baking powder, salt, parmesan cheese, water, rolled oats
Bubble Ball Bonbons,rice bubbles, desiccated coconut, butter, marshmallows, white chocolate chips
Fresh Cherry Smoothie,sweet cherries, ice, plain fat - free yogurt, honey
Spicy Raspberry Balsamic Dressing,olive oil, balsamic vinegar, sesame oil, raspberry preserves, salt, onion powder, ground black pepper, cayenne pepper, dry mustard
Shortbread Cookies "Hugs & Kisses" Recipe,flour, cornstarch, "confectioners sugar", butter
Naan Bread,active dry yeast, sugar, warm water, all - purpose flour, salt, clarified butter
Parmesan Polenta,chicken broth, whole milk, yellow cornmeal, parmesan cheese, unsalted butter, black pepper
Cheddar and Black Pepper Biscuits,unbleached all - purpose flour, baking powder, baking soda, salt, sugar, butter, cheddar cheese, fresh coarse ground black pepper, buttermilk
Maple-Glazed Sweet Potatoes,vegetable oil, sweet potatoes, pure maple syrup, unsalted butter
Ruth Feeney's Blackberry Jelly,water, blackberries, lemon juice, dry pectin, sugar, unsalted butter
Peachy Cake,canned peaches, margarine, butter pecan cake mix
Marmalade-Glazed Spareribs,soy sauce, orange marmalade, orange juice, garlic, ground ginger, pork spareribs
Pepperoncini Pork Roast,boneless pork roast, pepperoncini peppers, black pepper, sea salt, dried oregano, dried basil, dried rosemary, dried mustard, spinach
Awesome Healing Chicken Broth,water, chicken soup base, dried basil, garlic, cornstarch, cold water, rice wine vinegar, cayenne pepper, white pepper, egg substitute, sesame oil
Macedonian Sausages Filling,ground pork, leeks, red peppers, black pepper, ground cumin, dried oregano, garlic powder, paprika
My Gingernut Biscuits/Cookies,self raising flour, ground ginger, baking soda, ground cinnamon, low - fat margarine, brown sugar, clear honey
Roasted Strawberries with Black Pepper,strawberries, sugar, fresh ground black pepper, balsamic vinegar
Whipped Carrots With Cranberries,fresh carrots, unsalted butter, brown sugar, ground ginger, salt, dried cranberries
Besan Barfee Recipe,chickpea flour, vegetable oil, sugar, cardamom seeds, pistachios, almonds
How-to Roast Almonds Recipe elanaspantry,almonds, sea salt
Chocolate Cherry Granola Bites,old fashioned oats, whole wheat flour, baking soda, ground flax seeds, vanilla extract, applesauce, honey, water, dark chocolate chips, dried cherries
Almond Crescents # 2,butter, granulated sugar, flour, cornstarch, vanilla extract, almonds, chocolate chips, butter
Nana's Butter Biscuits,flour, CALUMET Baking Powder, salt, cream of tartar, sugar, margarine, milk
Spiced Pumpkin Butter Spread,pumpkin puree, cinnamon, lemon juice, nutmeg, ginger, salt, light brown sugar
Easy Hand Kneaded Bagel,bread flour, sugar, salt, dry yeast, water, honey
Sriracha Barbeque Sauce,ketchup, brown sugar, hot sauce, soy sauce, teriyaki sauce, kosher salt, garlic powder, vinegar
Taco Seasoning,chili powder, garlic powder, onion powder, oregano, cumin, sea salt
Buttermilk Biscuits,milk, vinegar, all - purpose flour, baking powder, baking soda, salt, oil
Old Fashioned Shortbread Cookies - Shortbread,all - purpose flour, cornstarch, powdered sugar, butter, 
Dianes Butternut Squash Soup,squash, chicken broth, diced onions, 4 Tablespoons Butter - No Substitutes, Please!, brown sugar, salt, evaporated milk, black pepper, nutmeg
High-Protein Milk,milk, non - fat powdered milk
No Bake Granola Balls,rolled oats, unsweetened dried shredded coconut, crunchy peanut butter, honey, brown sugar, mixed nuts, raisins, dried cranberries
Applesauce Cake (Ob'l Dunkes Kucka) Recipe,applesauce, brown sugar, cinnamon, cloves, raisins, butter, 1 tsp Soda, flour, nutmeg, salt
Shrimp Stir-Fry,cornstarch, chicken stock, soy sauce, sesame oil, vegetable oil, medium shrimp, assorted fresh vegetables, ground ginger, garlic powder, long - grain white rice
Fruit, Fiber & Nuts,dates, PLANTERS Walnuts, nonfat milk, sugar
Beef Flavored Rice,beef bouillon cubes, water, butter, brown rice
Grilled Asian Spiced Pork Ribs,pork ribs, ponzu sauce, sesame oil, cayenne
Peanut Butter Chocolate Chip Cookie Dough Dip,butter, brown sugar, vanilla extract, light cream cheese, creamy peanut butter, powdered sugar, "Reeses Peanut Butter cups", chocolate chips
